배__09/NNG	그/MM 결과/NNG 올/MM 쌀/NNG 재고량/NNG 은/JX 세계식량기구/NNP (/SS FAO/SL )/SS 권장/NNG 량/NNG 의/JKG 두/MM 	배/NNG	를/JKO 훨씬/MAG 넘/VV 는/ETM 1/SN 천/NR 3/SN 백만/NR 섬/NNB 에/JKB 이르/VV 고/EC 있/VX 으며/EC ,/SP 내년/NNG 에/JKB ᆫ/JX 1/SN 천/NR 5/SN 백만/NR 섬/NNB 이나/JX 되/VV 
배__09/NNG	에/JKB 따르/VV 아/EC 일부/NNG 가전제품/NNG 특별/NNG 소비세/NNG 의/JKG 인하/NNG 시한/NNG 만료/NNG 등/NNB 악재/NNG 에/JKB 도/JX 불구/XR 하/XSV 고/EC 지난해/NNG 하반기/NNG 보다/JKB 많/VA 게/EC 는/JX 두/MM 	배/NNG	까지/JX 매출/NNG 이/JKS 늘/VV ᆯ/ETM 것/NNB 으로/JKB 업계/NNG 는/JX 기대/NNG 하/XSV 았/EP 다/EF ./SF 
배__09/NNG	김종윤/NNP 기자/NNG </SS yoonn/SL @/SW joongang/SL ./SP co/SL ./SP kr/SL >/SS 뉴스/NNG 브리핑/NNG //SP 친/XPN 환경/NNG 쌀/NNG 재배/NNG 2/SN 	배/NNG	늘/VV 었/EP 다/EC 쌀/NNG 농업/NNG 이/JKS 어려움/NNG 을/JKO 겪/VV 는/ETM 가운데/NNG 비료/NNG ./SP 농약/NNG 을/JKO 적/VA 게/EC 치/VV 거나/EC 안/MAG 쓰/VV 는/ETM 친/XPN 환경/NNG 쌀/NNG 
배__09/NNG	이/JKS 어려움/NNG 을/JKO 겪/VV 는/ETM 가운데/NNG 비료/NNG ./SP 농약/NNG 을/JKO 적/VA 게/EC 치/VV 거나/EC 안/MAG 쓰/VV 는/ETM 친/XPN 환경/NNG 쌀/NNG 재배/NNG 가/JKS 지난해/NNG 보다/JKB 두/MM 	배/NNG	넘/VV 게/EC 늘어나/VV ᆫ/ETM 것/NNB 으로/JKB 나타나/VV 았/EP 다/EF ./SF 
배__09/NNG	이/MM 회사/NNG 의/JKG 최희관/NNP 팀장/NNG 은/JX "/SS 올/MM 상반기/NNG 전체/NNG 이용/NNG 고객/NNG 수/NNG 가/JKS 지난해/NNG 같/VA 은/ETM 기간/NNG 의/JKG 5/SN 	배/NNG	에/JKB 이/NP 를/JKO 정도/NNG 로/JKB 이용자/NNG 가/JKS 급증/NNG 하/XSV 는/ETM 추세/NNG "/SS 라고/JKQ 말/NNG 하/XSV 았/EP 다/EF ./SF 
배__09/NNG	지만/EC 이/NP 는/JX 잘못/MAG 되/XSV ᆫ/ETM 생각/NNG "/SS 이/VCP 라며/EC "/SS 실제/MAG 어느/MM 은행/NNG 에/JKB 돈/NNG 을/JKO 맡기/VV 냐/EC 에/JKB 따르/VV 아/EC 수익/NNG 률/XSN 이/JKS 	배/NNG	이상/NNG 차이/NNG 나/VV ᆯ/ETM 수/NNB 있/VV 다/EC "/SS 고/JKQ 말/NNG 하/XSV 았/EP 다/EF ./SF 
배__09/NNG	전체/NNG 자산/NNG 에서/JKB 현금/NNG 이/JKS 차지/NNG 하/XSV 는/ETM 비중/NNG 은/JX 올해/NNG 초/NNB 2/SN ./SP 71/SN %/SW 에서/JKB 1/SN 일/NNB 현재/MAG 5/SN ./SP 37/SN %/SW 로/JKB 	배/NNG	가량__x06/NNG 늘/VV 었/EP 다/EF ./SF 
배__09/NNG	영양/NNG 보충/NNG 식품/NNG 10/SN 종/NNG 중/NNB 1/SN 종/NNG 을/JKO 제외/NNG 하/XSV ᆫ/ETM 9/SN 종/NNG 의/JKG 일부/NNG 영양/NNG 성분/NNG 함량/NNG 은/JX 표시/NNG 량/NNG 의/JKG 2/SN 65/SN 	배/NNG	에/JKB 이르/VV 는/ETM 것/NNB 으로/JKB 조사/NNG 되/XSV 었/EP 다/EF ./SF 
배__02/NNG	나/NP 로/JKB 도/JX 는/JX 1996/SN 년/NNB 이후/NNG 고흥반도/NNP 와/JC 연륙교/NNG 로/JKB 연결/NNG 되/XSV 어/EC 	배/NNG	를/JKO 타/VV 지/EC 않/VX 고/EC 도/JX 들어가/VV ᆯ/ETM 수/NNB 있/VV 다/EF ./SF 
배__01/NNG	주/VV 는/ETM 대로/NNB 나오/VV 는/ETM 대로/NNB 다/MAG 먹/VV 다/EC 보/VX 면/EC 	배/NNG	가/JKS 너무/MAG 부르/VV 어/EC 일어나/VV 기/ETN 힘들/VA 어/EC 지/VX ᆫ다/EF ./SF 
배__09/NNG	이틀/NNG 간/NNB 타/VV 고/EC 가/VV 아야/EC 하/VX ᆯ/ETM 버스/NNG 에/JKB 오르/VV 자마자/EC ,/SP 나/NP 는/JX 내/NP 가/JKS 속/VV 아서/EC 특급/NNG 의/JKG 몇/MM 	배/NNG	나/JX 되/VV 는/ETM 가격/NNG 을/JKO 치르/VV 고/EC 도/JX 일반/NNG 버스/NNG 에/JKB 태우/VV 어/EC 지/VX 었/EP 다는/ETM 사실/NNG 을/JKO 깨닫/VV 았/EP 다/EF ./SF 
배__09/NNG	그런데/MAJ 지난해/NNG 1/SN 인/NNG 당/XSN 국민/NNG 소득/NNG 은/JX 8/SN 천/NR 9/SN 백/NR 달러/NNB 로/JKB 73/SN 년/NNB (/SS 3/SN 백/NR 94/SN 달러/NNB )/SS 의/JKG 20/SN 	배/NNG	를/JKO 넘/VV 었/EP 다/EF ./SF 
배__09/NNG	서울/NNP )/SS 이/JKS 1/SN 만/NR 8/SN 백/NR 원/NNB 에서/JKB 20/SN 만/NR 7/SN 천/NR 원/NNB 으로/JKB 18/SN 	배/NNG	이상/NNG 뛰/VV ᆫ/ETM 것/NNB 을/JKO 비롯/XR 하/XSV 아/EC 소비자/NNG 물가/NNG 는/JX 평균/NNG 11/SN 배/NNG 로/JKB 오르/VV 았/EP 다/EF ./SF 
배__09/NNG	8/SN 백/NR 원/NNB 에서/JKB 20/SN 만/NR 7/SN 천/NR 원/NNB 으로/JKB 18/SN 배/NNG 이상/NNG 뛰/VV ᆫ/ETM 것/NNB 을/JKO 비롯/XR 하/XSV 아/EC 소비자/NNG 물가/NNG 는/JX 평균/NNG 11/SN 	배/NNG	로/JKB 오르/VV 았/EP 다/EF ./SF 
배__02/NNG	경계/NNG 가/JKS 더욱/MAG 삼엄/XR 하/XSA 아/EC 지/VX 어/EC 해상/NNG 탈출/NNG 의/JKG 성공도/NNG 가/JKS 희박/XR 하/XSA 아/EC 지/VX ᆯ/ETM 뿐/NNB 더러/JKB 해상/NNG 탈출/NNG 도구/NNG 이/VCP ᆫ/ETM 	배/NNG	의/JKG 확보/NNG 도/JX 어렵/VA 고/EC ,/SP 북한/NNP 의/JKG 생활난/NNG 이/JKS 최근/NNG 조금/NNG 씩/XSN 개선/NNG 되/XSV 는/ETM 실정/NNG 등/NNB 을/JKO 이유/NNG 로/JKB 정부/NNG 는/JX 낙관/NNG 하/XSV 
배__02/NNG	북측/NNG 이/JKS 탈출/NNG 하/XSV 는/ETM 	배/NNG	를/JKO 저지/NNG 하/XSV 기/ETN 위하/VV 아/EC 해상/NNG 경계선/NNG 을/JKO 넘어오/VV ᆯ/ETM 수/NNB 있/VV 고/EC ,/SP 경우/NNG 에/JKB 따르/VV 아서/EC ᆫ/JX 총격/NNG 을/JKO 가하/VV ᆯ/ETM 수/NNB 
배__02/NNG	나/EC //SP 위성/NNG 항법/NNG 장치/NNG 이용/NNG 최단/NNG 거리/NNG 항로/NNG 南下/SH 북한/NNP 의/JKG 순종식/NNP (/SS 70/SN )/SS 씨/NNB 일가족/NNG 등/NNB 21/SN 명/NNB 의/JKG 주민/NNG 들/XSN 이/JKS 	배/NNG	를/JKO 타/VV 고/EC 귀순/NNG 하/XSV 아/EC 오/VX ᆯ/ETM 수/NNB 있/VV 었/EP 던/ETM 것/NNB 은/JX 이/NP 들/XSN 의/JKG 치밀/XR 하/XSA ᆫ/ETM 준비/NNG 와/JC 북한/NNP 당국/NNG 의/JKG 
배__02/NNG	씨/NNB 의/JKG 아들/NNG 이/VCP 자/EC 선장/NNG 이/VCP ᆫ/ETM 용범/NNP (/SS 45/SN )/SS 씨/NNB 의/JKG 풍부/XR 하/XSA ᆫ/ETM 항해/NNG 경험/NNG 과/JC 거사/NNG 에/JKB 이용/NNG 하/XSV ᆫ/ETM 	배/NNG	가/JKS 위성/NNG 항법/NNG 장치/NNG (/SS GPS/SL )/SS 가/JKS 장착/NNG 되/XSV ᆫ/ETM 중국/NNP 어선/NNG 이/VCP 라는/ETM 점/NNG 도/JX 엑소더스/NNG 성공/NNG 에/JKB 한몫/NNG 하/XSV 았/EP 다/EF ./SF 
배__02/NNG	에/JKB 근무/NNG 하/XSV 는/ETM 용범/NNP 씨/NNB 는/JX 이번/NNG 에/JKB 타/VV 고/EC 오/VV ᆫ/ETM '/SS 대두/NNP 8003/SN 호/NNB '/SS 의/JKG 선장/NNG 을/JKO 맡/VV 게/EC 되/VV 면서/EC 	배/NNG	안/NNG 에/JKB 비치/NNG 되/XSV ᆫ/ETM TV/SL 를/JKO 통하/VV 아/EC 남한/NNP 사회/NNG 의/JKG 활기차/VA 고/EC 풍요/NNG 롭/XSA ᆫ/ETM 모습/NNG 을/JKO 보/VV 고/EC 탈/XPN 북/NNP 을/JKO 결심/NNG 
배__02/NNG	북한/NNP 군인/NNG 과/JC 함정/NNG 의/JKG 경계망/NNG 을/JKO 피하/VV 아/EC 	배/NNG	를/JKO 최대/NNG 속도/NNG 이/VCP ᆫ/ETM 11/SN 노트/NNG 로/JKB 질주/NNG 하/XSV 아/EC 오전/NNG 6/SN 시/NNB 쯤/XSN 공해/NNG 상/XSN 으로/JKB 빠져나오/VV 았/EP 다/EF ./SF 
배__02/NNG	여러/MM 차례/NNG 중국/NNP 어선/NNG 을/JKO 만나/VV 았/EP 다/EF "/SS 며/EC "/SS 자칫/MAG 중국/NNP 으로/JKB 나포/NNG 되/XSV ᆯ/ETM 수/NNB 도/JX 있/VV 다고/EC 보/VV 고/EC 이/NP 들/XSN 	배/NNG	와/JC 일정/NNG 거리/NNG 를/JKO 유지/NNG 하/XSV 며/EC 조심/NNG 스럽/XSA 게/EC 남하/NNG 하/XSV 았/EP 다/EF "/SS 고/JKQ 말/NNG 하/XSV 았/EP 다/EF ./SF 
배__02/NNG	그러나/MAJ 조타실/NNG 에서/JKB 여자/NNG 한/MM 명/NNB 을/JKO 발견/NNG 하/XSV 곤/EC 밀입국/NNG 선박/NNG 으로/JKB 알/VV 고/EC 접근/NNG 하/XSV 았/EP 다가/EC 	배/NNG	쪽/NNB 에서/JKB "/SS 남한/NNP 에/JKB 가/VV 려고/EC 북한/NNP 에서/JKB 오/VV 았/EP 다/EC "/SS 는/ETM 荀/SH 씨/NNB 의/JKG 절박/XR 하/XSA ᆫ/ETM 얘기/NNG 를/JKO 접하/VV 았/EP 다/EF 
배__02/NNG	"/SS 공해/NNG 상/XSN 에서/JKB 진입/NNG 하/XSV 는/ETM 어선/NNG 의/JKG 경우/NNG 해경/NNG 경비정/NNG 이/JKS 단속/NNG 하/XSV 게/EC 되/VV 어/EC 있/VX 다/EC "/SS 며/EC "/SS 문제/NNG 의/JKG 	배/NNG	가/JKS 중국/NNP 어선/NNG 과/JC 비슷/XR 하/XSA ᆫ/ETM 소형/NNG 목선/NNG 이/VCP ᆫ/ETM 데/NNB 에/JKB 다/JX 외형/NNG 적/XSN 으로/JKB 특이/NNG 사항/NNG 이/JKS 발견/NNG 되/XSV 지/EC 않/VX 아/EC 
배__02/NNG	또/MAG 이번/NNG 21/SN 명/NNB 의/JKG 탈북자/NNG 가/JKS 타/VV 고/EC 오/VV ᆫ/ETM 	배/NNG	의/JKG 출항지/NNG 이/VCP ᆫ/ETM 평북/NNP 선천군/NNP 인근/NNG 염주군/NNP 다사도/NNP 에/JKB 있/VV 는/ETM 서해/NNP 함대/NNG 12/SN 전대/NNG 는/JX 상륙/NNG 함정/NNG 위주/NNG 의/JKG 12/SN 개/NNB 편대/NNG 로/JKB 
배__09/NNG	형/XSN 항공/NNG 사고/NNG 가/JKS 발생/NNG 하/XSV 아/EC 오/VX ᆫ/ETM 데/NNB 에/JKB 다/JX 우리나라/NNG 항공기/NNG 의/JKG 사고/NNG 율/XSN 도/JX 세계/NNG 평균/NNG 보다/JKB 약/MM 1/SN ./SP 5/SN 	배/NNG	높/VA 다/EF ./SF 
배__02/NNG	다투/VV 다/EC 회담/NNG 결렬/NNG 로/JKB 가/VV ᆫ/ETM 문제/NNG 이/VCP 라는/ETM 것/NNB 이/JKS ,/SP 새로/MAG 북/NNP 으로/JKB 가/VV 아야/EC 하/VX ᆯ/ETM 비료/NNG 를/JKO 싣/VV 은/ETM 첫/MM 	배/NNG	의/JKG 출항/NNG 이/JKS 이산가족/NNG 문제/NNG 논의/NNG 를/JKO 시작/NNG 하/XSV 기/ETN 전/NNG 이/VCP 냐/EC 다음/NNG 이/VCP 냐/EC 하/VV 는/ETM ,/SP 보/VV 기/ETN 에/JKB 따르/VV 아서/EC 는/JX 
배__02/NNG	1999/SN //SP 07/SN //SP 20/SN 「/SS 사설/NNG 」/SS 플루토늄/NNG 수송/NNG 을/JKO 우려/NNG 하/XSV ᆫ다/EC 일본/NNP 으로/JKB 플루토늄/NNG 을/JKO 수송/NNG 하/XSV 아/EC 가/VV ᆯ/ETM 	배/NNG	두/MM 척/NNB 이/JKS 그린피스/NNP 등/NNB 환경/NNG 단체/NNG 들/XSN 의/JKG 저지/NNG 에/JKB 도/JX 불구/XR 하/XSV 고/EC 19/SN 일/NNB 오후/NNG (/SS 현지/NNG 시각/NNG )/SS 영국/NNP 배로우항/NNP 을/JKO 
배__02/NNG	두/MM 달/NNG 동안/NNG 항해/NNG 를/JKO 계속/NNG 하/XSV ᆯ/ETM 이/MM 	배/NNG	들/XSN 은/JX 한반도/NNP 근해/NNG 를/JKO 지나/VV 게/EC 되/VV 어/EC 있/VX 어/EC ,/SP 우리/NP 도/JX 비상/NNG 하/XSA ᆫ/ETM 관심/NNG 을/JKO 기울이/VV 지/EC 않/VX 을/ETM 수/NNB 없/VA 
배__02/NNG	환경/NNG 운동/NNG 연합/NNG 등/NNB 환경/NNG 단체/NNG 와/JC 우리/NP 정부/NNG 의/JKG 우려/NNG 에/JKB ,/SP 일본/NNP 정부/NNG 는/JX 이/MM 	배/NNG	들/XSN 이/JKS 대한해협/NNP 을/JKO 지나/VV 지/EC 않/VX 을/ETM 것/NNB 이/VCP 라고/EC 알리/VV 어/EC 오/VX 았/EP 다고/EC 하/VX ᆫ다/EF ./SF 
배__02/NNG	그러나/MAJ 	배/NNG	두/MM 척/NNB 중/NNB 의/JKG 하나/NR 가/JKS 동해/NNP 쪽/NNB 에/JKB 면/XR 하/XSV ᆫ/ETM 다카하마항/NNP 으로/JKB 들어가/VV ᆯ/ETM 예정/NNG 이/VCP 기/ETN 때문/NNB 에/JKB ,/SP 전문가/NNG 들/XSN 은/JX 
배__02/NNG	악천후/NNG 로/JKB 	배/NNG	가/JKS 침몰/NNG 하/XSV ᆯ/ETM 수/NNB 도/JX ,/SP 테러리스트/NNG 들/XSN 의/JKG 습격/NNG 을/JKO 받/VV 을/ETM 수/NNB 도/JX ,/SP 배/NNG 안/NNG 에서/JKB 폭발/NNG 등/NNB 의/JKG 사고/NNG 가/JKS 
배__01/NNG	악천후/NNG 로/JKB 배/NNG 가/JKS 침몰/NNG 하/XSV ᆯ/ETM 수/NNB 도/JX ,/SP 테러리스트/NNG 들/XSN 의/JKG 습격/NNG 을/JKO 받/VV 을/ETM 수/NNB 도/JX ,/SP 	배/NNG	안/NNG 에서/JKB 폭발/NNG 등/NNB 의/JKG 사고/NNG 가/JKS 나/VV ᆯ/ETM 수/NNB 도/JX 있/VV 다/EF ./SF 
배__09/NNG	수입/NNG 이/JKS 수출/NNG 보다/JKB 2/SN 	배/NNG	이상/NNG 빨리/MAG 늘어나/VV ᆫ/ETM 결과/NNG ,/SP 무역/NNG 적자/NNG 도/JX 60/SN %/SW 나/JX 불어나/VV 았/EP 다/EF ./SF 
배__09/NNG	수입/NNG 은/JX 668/SN 만/NR 달러/NNB 에/JKB 달하/VV 았/EP 고/EC ,/SP 전기밥솥/NNG 과/JC 자기/NNG 그릇/NNG 의/JKG 경우/NNG 는/JX 작년/NNG 7/SN 월/NNB 에/JKB 비하/VV 아/EC 각각/MAG 4/SN 	배/NNG	와/JC 40/SN 배/NNG 로/JKB 늘/VV 었/EP 다/EF ./SF 
배__09/NNG	만/NR 달러/NNB 에/JKB 달하/VV 았/EP 고/EC ,/SP 전기밥솥/NNG 과/JC 자기/NNG 그릇/NNG 의/JKG 경우/NNG 는/JX 작년/NNG 7/SN 월/NNB 에/JKB 비하/VV 아/EC 각각/MAG 4/SN 배/NNG 와/JC 40/SN 	배/NNG	로/JKB 늘/VV 었/EP 다/EF ./SF 
배__09/NNG	유아/NNG 사망/NNG 률/XSN 이/JKS 낮/VA 아/EC 지/VX ᆫ/ETM 덕분/NNG 에/JKB 60/SN 년/NNB 에/JKB 30/SN 억/NR 이/VCP 던/ETM 인구/NNG 가/JKS 40/SN 년/NNB 만/NNB 에/JKB 그/MM 두/MM 	배/NNG	로/JKB 불어나/VV 았/EP 다는/ETM 사실/NNG 은/JX 인류/NNG 문명/NNG 의/JKG '/SS 개가/NNG '/SS 이/VCP 라고/EC 하/VV ᆯ/ETM 만/NNB 하/XSA 다/EF ./SF 
배__09/NNG	ᆫ/ETM 인구/NNG 증가/NNG 에/JKB 경종/NNG 을/JKO 울리/VV 었/EP 던/ETM 1798/SN 년/NNB 당시/NNG 세계/NNG 인구/NNG 가/JKS 10/SN 억/NR 이/VCP 었/EP 다니/EC 200/SN 년/NNB 만/NNB 에/JKB 여섯/NR 	배/NNG	로/JKB 불어나/VV ᆫ/ETM 셈/NNB 이/VCP 다/EF ./SF 
배__09/NNG	둘째/NR 원숭이/NNG 에이즈/NNG 바이러스/NNG (/SS SIV/SL )/SS 중/NNB 가장/MAG 독/NNG 성/XSN 이/JKS 강/XR 하/XSA ᆫ/ETM '/SS SIV/SL 239/SN '/SS 를/JKO 보통/NNG 감염량/NNG 보다/JKB 10/SN 	배/NNG	나/JX 많이/MAG 투입/NNG 하/XSV 았/EP 는데/EC 도/JX 치료/NNG 에/JKB 성공/NNG 하/XSV 았/EP 다는/ETM 점/NNG 이/VCP 다/EF ./SF 
배__09/NNG	최근/NNG 들/VV 어/EC 단기/NNG 출가/NNG 수련회/NNG 지원자/NNG 가/JKS 모집/NNG 인원/NNG 의/JKG 2/SN 3/SN 	배/NNG	혹은/MAG 수십/NR 배/NNG 를/JKO 넘어서/VV 고/EC 있/VX 어/EC 참가/NNG 목적/NNG 등/NNB 으로/JKB 심사/NNG 를/JKO 거치/VV 어/EC 참가자/NNG 를/JKO 뽑/VV 기/ETN 도/JX 하/VX ᆫ다/EF ./SF 
배__09/NNG	최근/NNG 들/VV 어/EC 단기/NNG 출가/NNG 수련회/NNG 지원자/NNG 가/JKS 모집/NNG 인원/NNG 의/JKG 2/SN 3/SN 배/NNG 혹은/MAG 수십/NR 	배/NNG	를/JKO 넘어서/VV 고/EC 있/VX 어/EC 참가/NNG 목적/NNG 등/NNB 으로/JKB 심사/NNG 를/JKO 거치/VV 어/EC 참가자/NNG 를/JKO 뽑/VV 기/ETN 도/JX 하/VX ᆫ다/EF ./SF 
배__01/NNG	휴식/NNG 참/NNG 마다/JX 돌아앉/VV 아/EC 한/MM 숟가락/NNG 퍼먹/VV 고/EC 는/JX 혀/NNG 내밀/VV 어/EC 입술/NNG 빨/VV 고/EC 손/NNG 으로/JKB 입/NNG 문지르/VV 며/EC 하/VX 는/ETM 말/NNG '/SS 	배/NNG	아프/VA 아/EC 약/NNG 을/JKO 먹/VV 자니/EC 몹시/MAG 쓰/VA 군/EF !/SF 
배__01/NNG	에서/JKB )/SS 궁금/XR 하/XSA ᆫ/ETM 마음/NNG 에/JKB 약단지/NNG 를/JKO 열/VV 어/EC 보/VX ᆫ/ETM 동물/NNG 동무/NNG 들/XSN 이/JKS 꿀/NNG 을/JKO 다/MAG 먹/VV 고/EC "/SS 우리/NP 도/JX 	배/NNG	가/JKS 아프/VA 아서/EC 그것/NP ᆯ/JKO 먹/VV 었/EP 는데/EC 어찌나/MAG 쓰/VA ᆫ지/EC 겨우/MAG 먹/VV 었/EP 어요/EC "/SS 라며/EC 곰/NNG 을/JKO 놀리/VV 자/EC 결국/NNG 곰/NNG 은/JX 비/VA 
배__02/NNG	사고/NNG 하/XSV 는/ETM 머리/NNG ,/SP 노동/NNG 하/XSV 는/ETM 사지/NNG ,/SP 생산/NNG 과/JC 성/NNG 의/JKG 	배/NNG	,/SP 그리고/MAJ 포용/NNG 하/XSV 는/ETM 가슴/NNG 등/NNB 몸/NNG 을/JKO 네/MM 부분/NNG 으로/JKB 나누/VV 고/EC 이/NP 에/JKB 따르/VV 아/EC 춤/NNG 도/JX 4/SN 개/NNB 의/JKG 장/NNG 으로/JKB 
배__01/NNG		배/NNG	가/JKS 불룩/MAG 하/XSA ᆫ/ETM 뚱뚱/MAG 하/XSA ᆫ/ETM 아저씨/NNG 가/JKS 생선/NNG 을/JKO 사/VV 어/EC 오/VX 면/EC ,/SP 그/MM 커다랗/VA ᆫ/ETM 뱃속/NNG 에서/JKB 물고기/NNG 가/JKS 헤엄치/VV 는/ETM 
배__09/NNG	미/NNP 교역/NNG 급증/NNG 올/MM 1/SN //SP 4/SN 분기/NNG 북/NNP -/SS 미/NNP 교역액/NNG 은/JX 219/SN 만/NR 4/SN 천/NR 달러/NNB 로/JKB 지난해/NNG 같/VA 은/ETM 기간/NNG 보다/JKB 100/SN 	배/NNG	,/SP 지나/VV ᆫ/ETM 한/MM 해/NNG 두/MM 나라/NNG 총/MM 교역액/NNG (/SS 67/SN 만/NR 달러/NNB )/SS 보다/JKB 3/SN 배/NNG 이상/NNG 늘/VV 었/EP 다고/EC 미국/NNP 의/JKG (/SS 자유아시아방송/NNP 
배__09/NNG	달러/NNB 로/JKB 지난해/NNG 같/VA 은/ETM 기간/NNG 보다/JKB 100/SN 배/NNG ,/SP 지나/VV ᆫ/ETM 한/MM 해/NNG 두/MM 나라/NNG 총/MM 교역액/NNG (/SS 67/SN 만/NR 달러/NNB )/SS 보다/JKB 3/SN 	배/NNG	이상/NNG 늘/VV 었/EP 다고/EC 미국/NNP 의/JKG (/SS 자유아시아방송/NNP )/SS (/SS RFA/SL )/SS 이/JKS 9/SN 일/NNB 미국/NNP 상무/NNG 부/NNG 센서스/NNG 국/NNG 의/JKG 자료/NNG 를/JKO 따/VV 아서/EC 
배__09/NNG	일본/NNP 팀/NNG 과/JC 한국/NNP 팀/NNG 이/JKS 이기/VV ᆯ/ETM 경우/NNG 맥주/NNG 를/JKO 공짜/NNG 로/JKB 제공/NNG 하/XSV 거나/EC 음식/NNG 값/NNG 을/JKO 이기/VV ᆫ/ETM 골/NNG 수/NNG 에/JKB 10/SN 	배/NNG	를/JKO 곱/NNG 하/XSV ᆫ/ETM 비율/NNG 로/JKB 할인/NNG 하/XSV 는/ETM 이벤트/NNG 를/JKO 벌이/VV 며/EC 분위기/NNG 를/JKO 띄우/VV 었/EP 다/EF ./SF 
배__09/NNG	,/SP 생산/NNG 직/NNG 은/JX 12/SN ./SP 3/SN %/SW 가/JKS 줄/VV 었/EP 으며/EC ,/SP 남성/NNG 이/JKS 6/SN %/SW 주/VV ᆫ/ETM 데/NNB 비하/VV 아/EC 여성/NNG 은/JX 그/MM 	배/NNG	에/JKB 가깝/VA ᆫ/ETM 11/SN %/SW 가/JKS 줄어들/VV 었/EP 다/EF ./SF 
배__02/NNG	북한/NNP 의/JKG 꽃게잡이/NNG 	배/NNG	와/JC 경비정/NNG 은/JX 이달/NNG 들/VV 어서/EC 만/JX 6/SN 차례/NNG 나/JX 북방/NNG 한계선/NNG 을/JKO 침범/NNG 하/XSV 았/EP 다/EF ./SF 
배__02/NNG	서해/NNP 교전/NNG 당시/NNG 꽃게/NNG 잡이__x03/NNG 에/JKB 나서/VV 었/EP 던/ETM 선원/NNG ᄀ/NNG 씨/NNB 는/JX "/SS 교전/NNG 이/JKS 일어나/VV 기/ETN 직전/NNG 까지/JX 도/JX 10/SN 여/XSN 척/NNB 의/JKG 	배/NNG	가/JKS 적색/NNG 선/NNG 을/JKO 넘/VV 어서/EC 조업/NNG 을/JKO 하/VV 고/EC 있/VX 었/EP 다/EC "/SS 고/JKQ 증언/NNG 하/XSV 았/EP 다/EF ./SF 
배__09/NNG	특히/MAG 충청/NNP 과/JC 강원/NNP 지역/NNG 의/JKG 라돈/NNG 농도/NNG 는/JX 전국/NNG 평균/NNG 을/JKO 두/MM 	배/NNG	이상/NNG 웃돌/VV 았/EP 고/EC ,/SP 조사/NNG 대상/NNG 의/JKG 1/SN ./SP 7/SN %/SW 는/JX 국제방사선방호위원회/NNP (/SS ICRP/SL )/SS 의/JKG 권고/NNG 기준/NNG 을/JKO 넘어서/VV ᆫ/ETM 것/NNB 으로/JKB 
배__09/NNG	조선일보/NNP 는/JX 기사/NNG 의/JKG 이/MM 대목/NNG 을/JKO 제목/NNG 에/JKB 반영/NNG 하/XSV 아/EC "/SS 저수량/NNG 현/MM 2/SN 	배/NNG	로/JKB …/SE 붕괴/NNG 때/NNG ᆫ/JX 엄청나/VA ᆫ/ETM 피해/NNG "/SS ,/SP "/SS 평화/NNG 의/JKG 댐/NNG 보강/NNG 은/JX 착공/NNG 시기/NNG 도/JX 못/MAG 정하/VV 아/EC "/SS 라고/JKQ 달/VV 
배__09/NNG	매우/MAG 친근감/NNG 을/JKO 느끼/VV ᆫ다/EC "/SS 가/JKS 16/SN ./SP 3/SN %/SW 로/JKB ,/SP 지난해/NNG 11/SN 월/NNB 조사/NNG 때/NNG 의/JKG 9/SN ./SP 5/SN %/SW 보다/JKB 두/MM 	배/NNG	가까이/MAG 높/VA 았/EP 다/EF ./SF 
배__02/NNG	이날/NNG 도/JX 거의/MAG 모든/MM 	배/NNG	들/XSN 이/JKS 어업/NNG 통제/NNG 선/NNG 을/JKO 넘/VV 었/EP 다/EF ./SF 
배__02/NNG	50/SN 여/XSN 척/NNB 의/JKG 	배/NNG	들/XSN 이/JKS 일제히/MAG 어업/NNG 통제/NNG 선/NNG 을/JKO 넘/VV 었/EP 다/EF ./SF 
배__02/NNG	북한/NNP 경비정/NNG 이/JKS 남하/NNG 하/XSV 고/EC 있/VX 으니/EC 즉시/NNG 조업/NNG 을/JKO 중단/NNG 하/XSV 고/EC 복귀/NNG 하/XSV 라는/ETM 경고/NNG 방송/NNG 이/JKS 있/VV 었/EP 지만/EC 많/VA 은/ETM 	배/NNG	들/XSN 이/JKS 이/NP 를/JKO 무시/NNG 하/XSV 고/EC 조업/NNG 을/JKO 하/VV 았/EP 다/EF ./SF 
배__09/NNG	14/SN 년/NNB 전/NNG 1/SN 억/NR 8/SN 천만/NR 원/NNB 을/JKO 주/VV 고/EC 사/VV ᆫ/ETM 땅/NNG 값/NNG 이/JKS 13/SN 	배/NNG	가량__x06/NNG 폭등/NNG 하/XSV 았/EP 고/EC ,/SP 애초/NNG 구입/NNG 목적/NNG 대로/JX 활용/NNG 되/XSV 지/EC 않/VX 고/EC 있/VX 는/ETM 점/NNG 때문/NNB 에/JKB 부동산/NNG 투기/NNG 의혹/NNG 을/JKO 받/VV 
배__09/NNG	임태희/NNP 제/XPN 2/SN 조정/NNG 위원장/NNG 은/JX 이/MM 자리/NNG 에서/JKB △/SW 보육/NNG 예산/NNG 두/MM 	배/NNG	이상/NNG 확대/NNG △/SW 저/XPN 소득/NNG 층/XSN 보육/NNG 지원/NNG 대상/NNG 확대/NNG △/SW 2010/SN 년/NNB 까지/JX 장애아/NNG 완전/NNG 무상/NNG 보육/NNG △/SW 아파트/NNG 건축/NNG 때/NNG 보육/NNG 시설/NNG 설치/NNG 
배__09/NNG	농특위/NNG 는/JX 이날/NNG 쌀/NNG 수확기/NNG 이/VCP ᆫ/ETM 올/MM 10/SN 월/NNB 말/NNG 재고/NNG 가/JKS 적정/NNG 재고/NNG 의/JKG 두/MM 	배/NNG	수준/NNG 이/VCP ᆫ/ETM 1318/SN 만/NR 섬/NNB 에/JKB 이르/VV ᆯ/ETM 것/NNB 으로/JKB 전망/NNG 되/XSV ᆫ다며/EC 재고/NNG 쌀/NNG 처리/NNG 를/JKO 위하/VV 아/EC 이미/MAG 주정/NNG 용/XSN 으로/JKB 공급/NNG 
배__09/NNG	//SP ㎥/SW )/SS ,/SP 도쿄/NNP (/SS 동경/NNP )/SS (/SS 40/SN ㎎/SW //SP ㎥/SW )/SS 등/NNB 에/JKB 비하/VV 아/EC 1/SN ./SP 7/SN ～/SO 3/SN ./SP 5/SN 	배/NNG	나/JX 높/VA 고/EC ,/SP 이산화질소/NNG 농도/NNG 역시/MAG 1/SN ./SP 7/SN 배/NNG 수준/NNG 이/VCP 다/EF ./SF 
배__09/NNG	//SP ㎥/SW )/SS 등/NNB 에/JKB 비하/VV 아/EC 1/SN ./SP 7/SN ～/SO 3/SN ./SP 5/SN 배/NNG 나/JX 높/VA 고/EC ,/SP 이산화질소/NNG 농도/NNG 역시/MAG 1/SN ./SP 7/SN 	배/NNG	수준/NNG 이/VCP 다/EF ./SF 
배__09/NNG	심/NNP 의원/NNG 등/NNB 은/JX "/SS 장/NNP 지명자/NNG 가/JKS 잠원동/NNP 아파트/NNG 를/JKO 분양/NNG 받/VV 아/EC 두세/MM 	배/NNG	의/JKG 시세/NNG 차익/NNG 을/JKO 보/VV 았/EP 고/EC ,/SP 85/SN 년/NNB 반포/NNG 아파트/NNG 에/JKB 2/SN 개월/NNB 20/SN 일/NNB 간__x16/NNG 위장/NNG 전입/NNG 하/XSV 아/EC 특별/NNG 분양/NNG 권/XSN 
배__09/NNG	기자/NNG ahn/SL @/SW hani/SL ./SP co/SL ./SP kr/SL 장상/NNP 서리/NNG 위장/NNG 전입/NNG //SP 가족/NNG 중/NNB 장/NNP 서리/NNG 부부/NNG 만/JX 잠원동/NNP 이전/NNG //SP 아파트/NNG 2/SN 3/SN 	배/NNG	시세/NNG 차익/NNG 의혹/NNG 29/SN 일/NNB 장상/NNP 총리/NNG 서리/NNG 인사/NNG 청문회/NNG 에서/JKB 장/NNP 총리/NNG 서리/NNG 가/JKS 투기/NNG 를/JKO 목적/NNG 으로/JKB 세/MM 차례/NNG 에/JKB 걸치/VV 어/EC 위장/NNG 
배__09/NNG	서리/NNG 부부/NNG 만/JX 서초구/NNP 잠원동/NNP 으로/JKB 주민/NNG 등록/NNG 을/JKO 옮기/VV ᆫ/ETM 뒤/NNG 신반포/NNP 아파트/NNG 를/JKO 분양/NNG 받/VV 아/EC 매매/NNG 하/XSV ᆫ/ETM 것/NNB 은/JX 2/SN 3/SN 	배/NNG	의/JKG 시세/NNG 차익/NNG 이/JKS 추정/NNG 되/XSV 는/ETM 만큼/NNB 투기/NNG 의혹/NNG 이/JKS 짙/VA 은/ETM 부분/NNG 이/VCP 다/EF ./SF 
배__09/NNG	면/EC ,/SP 이/MM 후보/NNG 는/JX 52/SN ./SP 7/SN %/SW 의/JKG 지지율/NNG 을/JKO 얻/VV 어/EC 16/SN ./SP 7/SN %/SW 에/JKB 그치/VV ᆫ/ETM 김/NNP 후보/NNG 를/JKO 3/SN 	배/NNG	이상/NNG 앞서/VV ᆫ/ETM 것/NNB 으로/JKB 나타나/VV 았/EP 다/EF ./SF 
배__09/NNG	보아/NNP 는/JX 올/MM 상반기/NNG 에/JKB 50/SN 여/XSN 만/NR 장/NNB 을/JKO 팔/VV 아/EC 지나/VV ᆫ/ETM 1/SN 집/NNB 의/JKG 2/SN ./SP 5/SN 	배/NNG	가깝/VA ᆫ/ETM 판매고/NNG 를/JKO 올리/VV 었/EP 고/EC ,/SP 롤러코스터/NNP 는/JX 10/SN 여/XSN 만/NR 장/NNB 을/JKO 팔/VV 아/EC 지나/VV ᆫ/ETM 앨범/NNG 의/JKG 2/SN 배/NNG 가깝/VA ᆫ/ETM 
배__09/NNG	./SP 5/SN 배/NNG 가깝/VA ᆫ/ETM 판매고/NNG 를/JKO 올리/VV 었/EP 고/EC ,/SP 롤러코스터/NNP 는/JX 10/SN 여/XSN 만/NR 장/NNB 을/JKO 팔/VV 아/EC 지나/VV ᆫ/ETM 앨범/NNG 의/JKG 2/SN 	배/NNG	가깝/VA ᆫ/ETM 판매고/NNG 를/JKO 올리/VV 었/EP 다/EF ./SF 
배__09/NNG	피아노/NNG 100/SN 	배/NNG	즐기/VV 기/ETN //SP 축구/NNG 와/JKB 닮/VV 은/ETM 점/NNG (/SS 2/SN )/SS //SP 실수/NNG 없이/MAG 평소/NNG 실력/NNG 살리/VV 려면/EC 기교/NNG 공부/NNG 소홀히/MAG 하/VV 지/EC 말/VX 아야/EC 
배__09/NNG	은/JX 한/MM 달/NNB 수업료/NNG 로/JKB 2/SN 만/NR 엔/NNB (/SS 20/SN 만/NR 원/NNB 정도/NNG )/SS 을/JKO 내/VV 는/ETM 반면/NNG ,/SP 이머전/NNG 프로그램/NNG 아이/NNG 들/XSN 은/JX 2/SN 	배/NNG	가/JKS 넘/VV 는/ETM 4/SN 만/NR 5500/SN 엔/NNB (/SS 45/SN 만/NR 원/NNB 정도/NNG )/SS 을/JKO 내/VV ᆫ다/EF ./SF 
배__01/NNG	…/SE 죽/VV 은/ETM 사람/NNG 은/JX 모두/MAG 머릿가죽/NNG 이/JKS 벗겨지/VV 었/EP 으며/EC ,/SP 한/MM 임신부/NNG 는/JX 	배/NNG	가/JKS 갈라지/VV 어/EC 있/VX 었/EP 고/EC 태아/NNG 가/JKS 옆구리/NNG 에/JKB 놓이/VV 어/EC 있/VX 었/EP 다/EF ./SF 
배__09/NNG	*/SW 피디에이/NNG (/SS PDA/SL )/SS 100/SN 	배/NNG	활용/NNG 하/XSV 기/ETN =/SW 피디에이/NNG 운영/NNG 체제/NNG 이/VCP ᆫ/ETM '/SS 팜/NNG '/SS 과/JC '/SS 포켓피시/NNG '/SS 에/JKB 맞/VV 는/ETM 350/SN 개/NNB 의/JKG 소프트웨어/NNG 활용법/NNG 을/JKO 
배__02/NNG	어린이/NNG ·/SP 아기/NNG 25/SN 명/NNB 을/JKO 포함/NNG 하/XSV 아/EC 102/SN 명/NNB 이/JKS 타/VV ᆫ/ETM 	배/NNG	가/JKS 인천항/NNP 을/JKO 떠나/VV ᆫ다/EF ./SF 
배__02/NNG	이/MM 	배/NNG	는/JX 하와이/NNP 로/JKB 가/VV 는/ETM 첫/MM 이민선/NNG '/SS 겐카이/NNP '/SS 호__x19/NNG ./SF 
배__01/NNG	그/MM 피해자/NNG 는/JX 건달/NNG 양철곤/NNP (/SS 차승원/NNP )/SS 이/VCP ᆫ데/EC ,/SP 그/NP 에게/JKB 는/JX 일/NR 년/NNB 동안/NNG 	배/NNG	를/JKO 곯/VV 았/EP 던/ETM 똘마니/NNG 들/XSN 이/JKS 있/VV 고/EC ,/SP 돈/NNG 을/JKO 못/MAG 벌/VV 어/EC 영/MAG 영/NNG 이/JKS 서/VV 지/EC ᆯ/JKO 않/VX 는/ETM 가족/NNG 이/JKS 
배__09/NNG	'/SS 싸인/NNP '/SS 감독/NNG 샤말란/NNP //SP "/SS 맨/NNG 인/NNG 블랙/NNG 은/JX 개런티/NNG 3/SN 	배/NNG	주/VV 어도/EC 안/MAG 만들/VV ᆫ다/EC "/SS "/SS 시나리오/NNG 를/JKO 쓰/VV 기/ETN 시작/NNG 하/XSV ᆯ/ETM 때/NNG ᆫ/JX 나/NP 도/JX 결말/NNG 을/JKO 모르/VV ᆫ다/EF ./SF 
배__09/NNG	지금/NNG 보다/JKB 3/SN 	배/NNG	의/JKG 개런티/NNG 를/JKO 주/VV ᆫ다고/EC 하/VV 아도/EC 만들/VV 지/EC 않/VX 을/ETM 것/NNB 이/VCP 다/EF ./SF 
배__01/NNG	■/SW 바보/NNG 들/XSN 의/JKG 	배/NNG	(/SS 교/NNP 오후/NNG 2/SN 시/NNB )/SS //SP 독일행/NNG 여객선/NNG 을/JKO 타/VV 다/EC 1930/SN 년대/NNB 멕시코/NNP 에서/JKB 독일/NNP 로/JKB 가/VV 는/ETM 여객선/NNG 에/JKB 타/VV ᆫ/ETM 사람/NNG 
