배__02/NNG	길수/NNP 가/JKS 우뚝/MAG 선북/NNG 에/JKB 서/VV 어서/EC 상앗대/NNG 로/JKB 	배/NNG	를/JKO 부리/VV 고/EC 있/VX 었/EP 다/EF ./SF 
배__02/NNG	바다/NNG 에/JKB 머물/VV 면서/EC 그물/NNG 질/XSN 을/JKO 하/VV 다가/EC 조금/NNG 때/NNG 가/JKC 되/VV 면/EC 일단/MAG 들어오/VV 아/EC 한/MM 사날/NNG 씩/XSN 쉬/VV 었/EP 다/EC 나가/VV 는/ETM 	배/NNG	이/VCP 었/EP 다/EF ./SF 
배__02/NNG	그런데/MAJ 	배/NNG	질/XSN 을/JKO 하/VV 던/ETM 길수/NNP 만/JX 은/JX 아낙/NNG 네/XSN 들/XSN 옆/NNG 을/JKO 지나치/VV 면서/EC 광주리/NNG 만/JX 하/VV ᆫ/ETM 입/NNG 을/JKO 벌리/VV 어/EC 헤벌쭉/MAG 웃/VV 는/ETM 
배__02/NNG	」/SS 노들목/NNG 에다/JKB 	배/NNG	를/JKO 대/VV 고/EC 나/VX 아서/EC 도/JX 자꾸/MAG 만/JX 뒤돌아보/VV 아/EC 가/VX 며/EC 연방/MAG 웃/VV 어/EC 보이/VV 는/ETM 길수/NNP 를/JKO 향하/VV 아/EC 입/NNG 빠르/VA ᆫ/ETM 삼열/NNP 
배__01/NNG	옷가지/NNG 와/JC 간단/XR 하/XSA ᆫ/ETM 화장/NNG 도구/NNG ,/SP 세면도구/NNG ,/SP 그리고/MAJ 몇/MM 권/NNB 의/JKG 책/NNG 들/XSN 로/JKB 제법/MAG 	배/NNG	가/JKS 부르/VV ᆫ/ETM 경화/NNP 의/JKG 트렁크/NNG 를/JKO 대신/NNG 들/VV 어/EC 나르/VV 면서/EC 도/JX 김/NNP 선생/NNG 은/JX 나무/NNG 꾼/XSN 처럼/JKB 산길/NNG 에/JKB 익숙/XR 하/XSA ᆫ/ETM 걸음/NNG 
배__01/NNG	사내/NNG 를/JKO 받아들이/VV ᆫ다는/ETM 그/MM 자체/NNG 가/JKS 우선/MAG 비리/VA ᆫ/ETM 것/NNB 에/JKB 달라붙/VV 는/ETM 쉬파리/NNG 처럼/JKB 몹시/MAG 성가시/VA ᆯ/ETM 뿐/NNB 더러/JKB 일/NNG 이/JKS 꼬이/VV 느라고/EC 	배/NNG	라도/EC 부르/VV 어/EC 지/VX ᆯ/ETM 때/NNG 이/VCP 면/EC 그것/NP ᆯ/JKO 지우/VV 는/ETM 데/NNB 또/MAG 가외/NNG 로/JKB 힘/NNG 이/JKS 부치/VV 는/ETM 것/NNB 이/VCP 었/EP 다/EF ./SF 
배__02/NNG	접때/NNG 맹키로/JKB 한강/NNP 에/JKB 	배/NNG	지나가/VV ᆫ/ETM 자리/NNG 지우/VV 어/EC 달/VX 라고/EC 사람/NNG 또/MAG 구찮/VA 게/EC 목매/VV 어/EC 달/VX 지/EC 말/VX 고/EF ./SF 
배__01/NNG	」/SS 「/SS 모기/NNG 	배/NNG	차/VV 라고/EC 꾀벗/VV 고/EC 자/VV 는구만/EF ./SF 
배__01/NNG	덤불/NNG 속/NNG 에/JKB 숨/VV 어서/EC 잠시/MAG 엿보/VV 는/ETM 동안/NNG 에/JKB 청년/NNG 들/XSN 은/JX 발/NNG 로/JKB 	배/NNG	를/JKO 걷어차/VV 고/EC 주먹/NNG 으로/JKB 볼때기/NNG 를/JKO 쥐/VV 어/EC 지르/VV 기/ETN 도/JX 하/VX 면서/EC 화냥녀/NNG ,/SP 똥갈보/NNG 같/VA 은/ETM 년/NNB 하/VV 고/EC 형편없이/MAG 욕지거리/NNG 를/JKO 
배__09/NNG	성/NNG 님/XSN 보담/JKB 열/NR 	배/NNG	는/JX 밝/VA 을/ETM 것/NNB 이/VCP 요/EF ./SF 
배__01/NNG	웬만큼/MAG 	배/NNG	가/JKS 꺼지/VV ᆯ/ETM 때/NNG 까지/JX 시간/NNG 을/JKO 보내/VV 어야/EC 되/VV 니까/EC 병신/NNG 이/JKC 되/VV ᆫ/ETM 한쪽/NNG 발/NNG 을/JKO 앞/NNG 으로/JKB 길/VA 게/EC 내/VV 어/EC 뻗/VV 
배__09/NNG	웅성웅성/MAG 하/XSV 는/ETM 소리/NNG 로/JKB 미루/VV 어/EC 참석/NNG 인원/NNG 도/JX 소수/NNG 의/JKG 부락/NNG 개발/NNG 위원/NNG 교무/NNG 가/JKC 아니/VCN 고/EC 그/NP 보다/JKB 몇/MM 	배/NNG	나/JX 많/VA 은/ETM 사람/NNG 들/XSN 이/JKS 모이/VV 어/EC 있/VX 는/ETM 성/NNB 싶/VX 었/EP 다/EF ./SF 
배__01/NNG	그러/VV 자/EC 	배/NNG	를/JKO 땅/NNG 에다/JKB 깔/VV 고/EC 얌전히/MAG 앉/VV 아/EC 있/VX 던/ETM 셰퍼드/NNG 두/MM 마리/NNB 가/JKS 동시/NNG 에/JKB 껑충/MAG 뛰어오르/VV 면서/EC 청년/NNG 의/JKG 팔/NNG 을/JKO 물/VV 어/EC 
배__01/NNG	앉/VV 으라면/EC 앉/VV 고/EC 스/VV 라면/EC 스/VV 고/EC 기/VV 라고/EC 허/VX 면/EC 군인/NNG 덜/XSN 맹키로/JKB 	배/NNG	를/JKO 땅바닥/NNG 으다/JKB 깔/VV 고시나/EC 불불/MAG 기/VV 고/EC …/SE …/SE 」/SS 「/SS 으런/NNG 덜/XSN 이/JKS 그러/VV 는디/EC 저/MM 개/NNG 덜/XSN 이/JKS 핵교/NNG 를/JKO 댕기/VV 었/EP 
배__02/NNG	순종/NNG 에/JKB 가깝/VA ᆫ/ETM ,/SP 우아/XR 하/XSA 면서/EC 도/JX 날쌔/VA 고/EC 용맹/NNG 스럽/XSA ᆫ/ETM 체형/NNG 을/JKO 갖추/VV ᆫ/ETM 세퍼드/NNG 종/NNG 이/VCP 었/EP 고/EC ,/SP 한/MM 	배/NNG	에서/JKB 나오/VV 았/EP 는지/EC 크기/NNG 도/JX 털빛/NNG 도/JX 분간/NNG 이/JKS 안/MAG 가/VV 는/ETM 쌍동이/NNG 모습/NNG 이/VCP 었/EP 고/EC ,/SP 목/NNG 을/JKO 묶/VV 는/ETM 끈/NNG 하나/NR 
배__03/NNG	돌개/NNP 사람/NNG 들/XSN 이/JKS 올리/VV 는/ETM 제사/NNG 에/JKB 타관/NNG 사람/NNG 이/JKS 나서/VV 어서/EC 감/NNG 놓/VV 아라/EC 	배/NNG	놓/VV 아라/EC 하/VX ᆯ/ETM 수/NNB 도/JX 없/VA 을/ETM 뿐/NNB 만/JX 아니/VCN 라/EC 돌개/NNP 하고/JKB 자신/NNG 을/JKO 엄연히/MAG 구분/NNG 짓/VV 는/ETM 마음가짐/NNG 가지/VV 고/EC 는/JX 돌개/NNP 
배__02/NNG	옆/NNG 으로/JKB 지나가/VV 는/ETM 	배/NNG	가/JKS 있/VV 을/ETM 때/NNG 마다/JX 그것/NP 들/XSN 은/JX 한쪽/NNG 에서부터/JKB 차례/NNG 로/JKB 날개/NNG 를/JKO 펴/VV 어/EC 하늘/NNG 을/JKO 빙빙/MAG 돌/VV 다가/EC 는/JX 다시/MAG 내리/VV 어/EC 
배__02/NNG	갯마을/NNG 이/VCP 지만/EC 	배/NNG	를/JKO 가지/VV 고/EC 실제로/MAG 고기잡이/NNG 를/JKO 하/VV 는/ETM 집/NNG 은/JX 삼백/NR 여/XSN 가구/NNG 가/JKS 넘/VV 는/ETM 돌개/NNP 에서/JKB 겨우/MAG 대여섯/NR 밖에/JX 안/MAG 되/VV 었/EP 다/EC 
배__02/NNG	를/JKO 가지/VV 고/EC 실제로/MAG 고기잡이/NNG 를/JKO 하/VV 는/ETM 집/NNG 은/JX 삼백/NR 여/XSN 가구/NNG 가/JKS 넘/VV 는/ETM 돌개/NNP 에서/JKB 겨우/MAG 대여섯/NR 밖에/JX 안/MAG 되/VV 었/EP 다/EC 	배/NNG	를/JKO 부리/VV 는/ETM 사람/NNG 도/JX 토박이/NNG 는/JX 서너/MM 명/NNB 뿐/NNB 이/VCP 고/EC ,/SP 거개/NNG 가/JKS 외처/NNG 에서/JKB 고용살이/NNG 오/VV ᆫ/ETM 어부/NNG 들이/XSN 이/VCP 었/EP 다/EF 
배__01/NNG	질퍽/XR 하/XSA ᆫ/ETM 개흙/NNG 이나/JC 얕/VA 은/ETM 갯물/NNG 에서/JKB 흔히/MAG 보/VV ᆯ/ETM 수/NNB 있/VV 는데/EC ,/SP 	배/NNG	와/JC 가슴/NNG 지느러미/NNG 의/JKG 육질/NNG 이/JKS 매우/MAG 발달/NNG 되/XSV 어/EC 수족/NNG 처럼/JKB 움직이/VV ᆯ/ETM 수/NNB 있/VV 기/ETN 때문/NNB 에/JKB 사람/NNG 을/JKO 보/VV 면/EC 땅바닥/NNG 이/VCP 
배__01/NNG	」/SS 「/SS 	배/NNG	터지/VV 어/EC 죽/VV 겄/EP 다/EF ./SF 
배__02/NNG	이/VCP 었/EP 는데/EC ,/SP 그러께/NNG 가을/NNG 에/JKB 꽁댕이배/NNG 를/JKO 사들이/VV 고/EC 금년/NNG 에/JKB 들/VV 어서/EC 는/JX 번듯/XR 하/XSA ᆫ/ETM 발동선/NNG 하나/NR 를/JKO 더/MAG 사/VV 아서/EC 	배/NNG	가/JKS 모두/MAG 네/MM 척/NNB 이/JKC 되/VV 어/EC 여러/MM 사촌/NNG 들/XSN 배/NNG 를/JKO 아프/VA 게/EC 만들/VV 었/EP 고/EC ,/SP 돌개/NNP 에서/JKB 는/JX 물론/NNG 웅포/NNP 까지/JX 합치/VV 
배__01/NNG	금년/NNG 에/JKB 들/VV 어서/EC 는/JX 번듯/XR 하/XSA ᆫ/ETM 발동선/NNG 하나/NR 를/JKO 더/MAG 사/VV 아서/EC 배/NNG 가/JKS 모두/MAG 네/MM 척/NNB 이/JKC 되/VV 어/EC 여러/MM 사촌/NNG 들/XSN 	배/NNG	를/JKO 아프/VA 게/EC 만들/VV 었/EP 고/EC ,/SP 돌개/NNP 에서/JKB 는/JX 물론/NNG 웅포/NNP 까지/JX 합치/VV 어서/EC 손꼽/VV 는/ETM 부자/NNG 가/JKC 되/VV 었/EP 던/ETM 것/NNB 이/VCP 다/EF 
배__01/NNG	하도/MAG 	배/NNG	가/JKS 고푸/VA ᆼ깨/EC 짱뚱이/NNG 이/VCP 라도/EC 잡아먹/VV 자고/EC 공론/NNG 이/JKS 돌/VV 아서/EC 하루/NNG 는/JX 사나/NNG 들/XSN 이/JKS 작당/NNG 을/JKO 허/VV 고/EC 갯바닥/NNG 으로/JKB 나가/VV 았/EP 
배__01/NNG	」/SS 「/SS 	배/NNG	,/SP 뱃속/NNG 이/JKS 좀/MAG 불편/NNG 하/XSA 아서/EC …/SE …/SE 」/SS 「/SS 제우/NNP 변소/NNG 나/JC 갈람서/NA 옷/NNG 까지/JX 갈/VV 어/EC 입/VV 고/EC 나서/VV 누만요/EF ?/SF 
배__01/NNG	」/SS 「/SS 좋아/IC ,/SP 네/NP 눔/NNB 이/JKS 나/NP 의/JKG 	배/NNG	를/JKO 찌르/VV ᆯ/ETM 수/NNB 만/JX 있/VV 다면/EC 내/NP 가/JKS 상/NNG 을/JKO 주/VV 지/EF ./SF 
배__01/NNG	「/SS 교장/NNG 선생/NNG 님/XSN 께/JKB 워쩌다가/MAG 이/MM 지경/NNB 으로/JKB …/SE …/SE 」/SS 어쩌/VV 고/EC 하/VV 면서/EC 김진봉/NNP 이/JKS 	배/NNG	를/JKO 불룩/MAG 하/XSA ᆫ/ETM 왕진/NNP 가방/NNG 을/JKO 열/VV 었/EP 다/EF ./SF 
배__01/NNG	그녀/NP 에게/JKB 먼저/MAG 말/NNG 을/JKO 걸/VV 지/EC 도/JX ,/SP 그녀/NP 의/JKG 물음/NNG 에/JKB 매번/MAG 대답/NNG 하/XSV 지/EC 도/JX 않/VX 았/EP 지만/EC ,/SP 곰/NNG 인형/NNG 의/JKG 	배/NNG	를/JKO 꾹/MAG 누르/VV 면/EC 엉뚱/XR 하/XSA ᆫ/ETM 낱말/NNG 들/XSN 이/JKS 튀어나오/VV 듯/EC ,/SP 서로/NNG 의/JKG 옷깃/NNG 이/JKS 스치/VV 거나/EC 몸/NNG 이/JKS 부딪치/VV 면/EC 어설프/VA 지만/EC 
배__09/NNG	그녀/NP 는/JX 보통/NNG 사람/NNG 팔뚝/NNG 의/JKG 	배/NNG	나/JX 되/VV 는/ETM 남자/NNG 의/JKG 팔뚝/NNG 을/JKO 머릿속/NNG 에서/JKB 그리/VV 어/EC 보/VX 았/EP 다/EF ./SF 
배__02/NNG	또/MAG 	배/NNG	가/JKS 없/VA 는/ETM 사람/NNG 들/XSN 은/JX 연/NNG 을/JKO 날리/VV 어/EC 수심/NNG 이/JKS 깊/VA 은/ETM 곳/NNG 에서/JKB 물고기/NNG 를/JKO 잡/VV 기/ETN 도/JX 하/VX 았/EP 고/EC ,/SP 
배__01/NNG	얼음판/NNG 위/NNG 에/JKB 덩그렇/VA 니/EC 놓이/VV ᆫ/ETM 한/MM 개/NNB 의/JKG 알/NNG 을/JKO 아버지/NNG 펭귄/NNG 이/JKS 두/MM 달/NNG 동안/NNG 다리/NNG 사이/NNG 에/JKB 끼/VV 고/EC 자신/NNG 의/JKG 	배/NNG	에/JKB 나/VV ᆫ/ETM 깃털/NNG 로/JKB 덮/VV 어/EC 부화/NNG 시키/XSV ᆫ다/EF ./SF 
배__02/NNG	"/SS 무사시/NNP 는/JX 	배/NNG	안/NNG 에서/JKB 목검/NNG 을/JKO 깎/VV 고/EC 있/VX 었/EP 어/EF ./SF 
배__02/NNG	고지로/NNP 는/JX 태양/NNG 을/JKO 등지/VV 고/EC 썰물/NNG 과/JKB 함께/MAG 밀려오/VV 는/ETM 	배/NNG	위/NNG 에/JKB 서/VV 어/EC 있/VX 는/ETM 무사시/NNP 의/JKG 그림자/NNG 를/JKO 보/VV 았/EP 지/EC …/SE …/SE ./SF 
배__01/NNG	대머리/NNG 나/JC 불룩/MAG 나오/VV ᆫ/ETM 	배/NNG	의/JKG 소유자/NNG 는/JX 그녀/NP 의/JKG 친구/NNG 는/JX 되/VV ᆯ/ETM 수/NNB 있/VV 어도/EC ,/SP 배우자/NNG 는/JX 되/VV ᆯ/ETM 수/NNB 없/VA 었/EP 다/EF ./SF 
배__02/NNG	"/SS 유리/NNP 가/JKS 혀/NNG 를/JKO 차/VV 며/EC 탐독/NNG 하/XSV 고/EC 있/VX 던/ETM 《/SS 레드/NNP 》/SS 이/VCP 란/ETM 여성/NNG 잡지/NNG 를/JKO 	배/NNG	에/JKB 올려놓/VV 으며/EC 빈정대/VV 었/EP 다/EF ./SF 
배__01/NNG	"/SS 유리/NNP 가/JKS 	배/NNG	를/JKO 움켜잡/VV 고/EC 웃/VV 기/ETN 시작/NNG 하/XSV 았/EP 다/EF ./SF 
배__02/NNG	선우/NNP 의/JKG 그/MM 모습/NNG 은/JX 호수/NNG 한/XPN 가운데/NNG 홀로/MAG 	배/NNG	를/JKO 띄우/VV ᆫ/ETM 낚시/NNG 꾼/XSN 의/JKG 모습/NNG 을/JKO 떠올리/VV 었/EP 고/EC ,/SP 예리/NNP 는/JX 그/NP 의/JKG 공간/NNG 을/JKO 침범/NNG 하/XSV 고/EC 싶/VX 지/EC 않/VX 다는/ETM 
배__02/NNG	바다/NNG 위/NNG 에/JKB 뜨/VV 어/EC 있/VX 는/ETM 	배/NNG	들/XSN ,/SP 그/MM 배/NNG 들/XSN 이/JKS 선우/NNP 의/JKG 모습/NNG 을/JKO 싣/VV 고/EC 있/VX 었/EP 다/EF ./SF 
배__02/NNG	바다/NNG 위/NNG 에/JKB 뜨/VV 어/EC 있/VX 는/ETM 배/NNG 들/XSN ,/SP 그/MM 	배/NNG	들/XSN 이/JKS 선우/NNP 의/JKG 모습/NNG 을/JKO 싣/VV 고/EC 있/VX 었/EP 다/EF ./SF 
배__02/NNG	키/NNG 크/VA ᆫ/ETM 남자/NNG 가/JKS 먼저/MAG 침몰/NNG 하/XSV 는/ETM 	배/NNG	에서/JKB 탈출/NNG 하/XSV 듯/EC 빠져나가/VV 았/EP 다/EF ./SF 
배__01/NNG		배/NNG	는/JX 고프/VA 았/EP 지만/EC 입맛/NNG 도/JX 음식/NNG 도/JX 형편없/VA 었/EP 다/EF ./SF 
배__09/NNG	고작/MAG 자기/NP 몸통/NNG 서너/MM 	배/NNG	가/JKC 되/VV 는/ETM 새장/NNG 안/NNG 에서/JKB 이/MM 가게/NNG 안/NNG 이/JKS 세상/NNG 전부/NNG 이/VCP ᆫ/ETM 줄/NNB 알/VV 며/EC 거만/NNG 을/JKO 떨/VV 지/EF ./SF 
배__01/NNG		배/NNG	가/JKS 부르/VV 어서/EC 지금/NNG 은/JX 못/MAG 먹/VV 을/ETM 것/NNB 같/VA 아/EF ./SF 
배__09/NNG	나/NP 는/JX 두고두고/MAG 몇/MM 십/NR 	배/NNG	몇/MM 백/NR 배/NNG 로/JKB 갚/VV 아야/EC 하/VX 았/EP 다/EF ./SF 
배__09/NNG	나/NP 는/JX 두고두고/MAG 몇/MM 십/NR 배/NNG 몇/MM 백/NR 	배/NNG	로/JKB 갚/VV 아야/EC 하/VX 았/EP 다/EF ./SF 
배__09/NNG	"/SS 이/MM 새끼/NNG 들/XSN ,/SP 내/NP 가/JKS 당장/NNG 가/VV 아서/EC 몇/MM 	배/NNG	로/JKB 갚/VV 아/EC 주/VX ᆯ/ETM 터/NNB 이/VCP 다/EF ./SF 
배__03/NNG	별님이/NNP 는/JX 볼펜/NNG 을/JKO 들/VV 고/EC '/SS 9/SN '/SS 자/NNG 에다/JKB 	배/NNG	를/JKO 그리/VV 어/EC 넣/VV 었/EP 습니다/EF ./SF 
배__01/NNG		배/NNG	가/JKS 불룩/MAG 하/XSV 아/EC 지/VX ᆫ/ETM 것/NNB 이/JKS 집/NNG 에서/JKB 데리/VV 고/EC 나오/VV ᆯ/ETM 때/NNG 와/JKB 는/JX 다르/VA 았/EP 습니다/EF ./SF 
배__01/NNG	그/MM 크/VA ᆫ/ETM 요술/NNG 책/NNG 을/JKO 다/MAG 먹/VV 어서/EC 	배/NNG	가/JKS 부르/VV 었/EP 거든요/EF ./SF 
배__01/NNG	"/SS 세상에/IC ,/SP 	배/NNG	가/JKS 고프/VA 았/EP 던/ETM 모양/NNG 이/VCP 구나/EC …/SE …/SE ./SF 
배__01/NNG	"/SS "/SS 	배/NNG	가/JKS 고프/VA 니까/EC 저/MM 혼자/NNG 나가/VV 아서/EC 먹이/NNG 를/JKO 구하/VV 아/EC 오/VX 았/EP 잖니/EF ./SF 
배__01/NNG	"/SS 신문지/NNG 일곱/NR 장/NNB 을/JKO 먹/VV 은/ETM 로로/NNP 는/JX 	배/NNG	가/JKS 부르/VV ᆫ지/EC 신문지/NNG 더미/NNG 위/NNG 에/JKB 주저앉/VV 아/EC 자기/NP 발/NNG 을/JKO 핥/VV 았/EP 습니다/EF ./SF 
배__09/NNG	2/SN 만/NR 원/NNB 은/JX 할머니/NNG 가/JKS 평소/NNG 에/JKB 벌/VV ᆫ/ETM 것/NNB 보다/JKB 네/MM 	배/NNG	나/JX 많/VA 은/ETM 돈/NNG 이/VCP 었/EP 습니다/EF ./SF 
배__09/NNG	"/SS "/SS 아저씨/NNG 는/JX ,/SP 나/NP 보다/JKB 두/MM 	배/NNG	는/JX 독/NNG 하/XSA ᆫ/ETM 담배/NNG 를/JKO 연짱/NNG 피우/VV 어/EC 대/VX 는/ETM 사람/NNG 도/JX 있/VV 구만/EC …/SE …/SE "/SS 희은/NNP 은/JX 말끝/NNG 을/JKO 흐리/VV 며/EC 베트남/NNP 
배__01/NNG	다/MAG 같이/MAG 	배/NNG	가/JKS 고프/VA ᆫ데/EC 자기/NP 만/JX 더/MAG 먹/VV 으려고/EC 하/VX 는/ETM '/SS 밥/NNG 벌레/NNG '/SS 를/JKO '/SS 짠돌이/NNG '/SS 이/VCP 라는/ETM 전사/NNG 는/JX "/SS 야/IC ,/SP 
배__09/NNG	다른/MM 수법/NNG 은/JX 같/VA 은/ETM 한/MM 그릇/NNG 을/JKO 푸/VV 어/EC 담/VV 더라도/EC 꾹꾹/MAG 누르/VV 어/EC 담/VV 아서/EC 실제/NNG 양/NNG 을/JKO 두/MM 	배/NNG	로/JKB 만들/VV 는/ETM 것/NNB 이/VCP 었/EP 다/EF ./SF 
배__01/NNG	"/SS 아침/NNG 을/JKO 거르/VV 고/EC 점심/NNG 마저/JX 제대로/MAG 먹/VV 지/EC 않/VX 은/ETM 재우/NNP 도/JX 	배/NNG	가/JKS 고프/VA 아/EC 오/VX 기/ETN 시작/NNG 하/XSV 던/ETM 참/NNB 이/VCP 었/EP 다/EF ./SF 
배__01/NNG	희은/NNP 이/JKS 	배/NNG	를/JKO 두드리/VV 어/EC 보이/VV 며/EC 손/NNG 을/JKO 내젓/VV 었/EP 지만/EC 소용/NNG 이/JKS 없/VA 었/EP 다/EF ./SF 
배__01/NNG	"/SS 	배/NNG	가/JKS 터지/VV 겠/EP 네/EF ./SF 
배__01/NNG	"/SS 희은/NNP 이/JKS 빵빵/XR 하/XSA 아/EC 지/VX ᆫ/ETM 재우/NNP 의/JKG 	배/NNG	를/JKO 두드리/VV 는/ETM 것/NNB 을/JKO 보/VV 고/EC 레지투이/NNP 가/JKS 빙그레/MAG 웃/VV 으며/EC 묻/VV 었/EP 다/EF ./SF 
배__09/NNG	지금/NNG 까지/JX 의/JKG 속도/NNG 로/JKB 143/SN 번/NNB 씬/NNG 까지/JX 마치/VV 려면/EC 사흘/NNG 이/JKC 아니/VCN 라/EC 그/MM 두/MM 	배/NNG	의/JKG 시간/NNG 이/JKS 필요/NNG 하/XSA 았/EP 다/EF ./SF 
배__01/NNG	저녁/NNG 무렵/NNB 이/JKC 되/VV 어서/EC 야/JX 비/VV ᆫ/ETM 	배/NNG	를/JKO 채우/VV 기/ETN 위하/VV 아/EC 프응미/NNP 로/JKB 가/VV 았/EP 다/EF ./SF 
배__02/NNG	건조/NNG 하/XSV ᆯ/ETM 때/NNG 마다/JX 	배/NNG	의/JKG 용도/NNG 와/JC 크기/NNG 가/JKS 다/MAG 다르/VA 고/EC 각자/MAG 하/VV 아야/EC 하/VX ᆯ/ETM 공정/NNG 도/JX 달라지/VV ᆯ/ETM 수/NNB 밖에/JX 없/VA 기/ETN 때문/NNB 이/VCP 다/EF ./SF 
배__09/NNG	약방/NNG 에서/JKB 약/NNG 을/JKO 짓/VV 어다/EC 먹/VV 었/EP 지만/EC 누이/NNG 의/JKG 발/NNG 과/JC 종아리/NNG 는/JX 그날/NNG 밤새/NNG 두/MM 	배/NNG	로/JKB 부풀/VV 어/EC 오르/VV 았/EP 고/EC 고통/NNG 스럽/XSA ᆫ/ETM 신음/NNG 은/JX 그치/VV 지/EC 않/VX 았/EP 다/EF ./SF 
배__09/NNG	그녀/NP 는/JX 마치/MAG 자기/NP 가/JKS 다치/VV 지/EC 않/VX 아서/EC 누이/NNG 가/JKS 두/MM 	배/NNG	의/JKG 중상/NNG 을/JKO 입/VV 은/ETM 것/NNB 처럼/JKB 죄/NNG 스럽/XSA 어/EC 하/VX 았/EP 다/EF ./SF 
배__09/NNG	녀석/NNB 의/JKG 키/NNG 와/JC 비슷/XR 하/XSA ᆫ/ETM 높이/NNG 의/JKG 비닐/NNG 자루/NNG 는/JX 부피/NNG 도/JX 녀석/NNB 의/JKG 몸피/NNG 보다/JKB 세/MM 	배/NNG	는/JX 더/MAG 되/VV 었/EP 다/EC 짊어지/VV 었/EP 다기/ETN 보다/JKB 어깨/NNG 뒤/NNG 로/JKB 끌/VV 며/EC 한/MM 계단/NNG 한/MM 계단/NNG 을/JKO 내려오/VV 는/ETM 녀석/NNB 이/JKS 오늘/NNG 따라/JX 
배__02/NNG	"/SS 저기/NP 떠나가/VV 는/ETM 	배/NNG	거칠/VA ᆫ/ETM 바다/NNG 외로이/MAG 겨울비/NNG 에/JKB 젖/VV 은/ETM 돛/NNG 에/JKB 가득/MAG 차/VV ᆫ/ETM 바람/NNG 을/JKO 안/VV 고서/EC …/SE …/SE "/SS 처연/XR 하/XSA ᆫ/ETM 가락/NNG 이/VCP 
배__02/NNG	"/SS 언제/MAG 우리/NP 다시/MAG 만나/VV ᆯ까/EC 꾸밈없이/MAG 꾸밈없이/MAG 홀로/MAG 떠나가/VV 는/ETM 	배/NNG	바람/NNG 소리/NNG 파도/NNG 소리/NNG 어둠/NNG 에/JKB 젖/VV 어서/EC 밀려오/VV ᆯ/ETM 뿐/NNB …/SE …/SE "/SS 골리앗/NNP 위/NNG 에서/JKB 배고픔/NNG 과/JC 외로움/NNG 과/JC 분노/NNG 속/NNG 에서/JKB 보내/VV 
배__02/NNG	그/MM 어느/MM 날/NNG 밤/NNG 캄캄/MAG 하/XSA ᆫ/ETM 골리앗/NNP 위/NNG 에서/JKB 울리/VV 어/EC 퍼지/VV 기/ETN 시작/NNG 하/XSV 았/EP 던/ETM 「/SS 떠나가/VV 는/ETM 	배/NNG	」/SS ,/SP 그/MM 노래/NNG 의/JKG 주인공/NNG 이/JKS 선욱/NNP 이/VCP 었/EP 다/EF ./SF 
배__01/NNG	밥투정/NNG 은/JX 	배/NNG	가/JKS 부르/VV 어서/EC 그런/MM 것/NNB 이/VCP 고/EC ,/SP 먹/VV 기/ETN 싫/VA 으면/EC 굶/VV 어야/EC 하/VX ᆫ다는/ETM 밥/NNG 에/JKB 대하/VV ᆫ/ETM 그/NP 의/JKG 엄격/XR 하/XSA ᆫ/ETM 
배__01/NNG		배/NNG	들/XSN 고프/VA 지/EC 않/VX 아/EF ?/SF 
배__01/NNG		배/NNG	도/JX 고프/VA 고/EC 원장/NNG 꼴/NNG 도/JX 보/VV 기/ETN 싫/VA 고/EF ./SF 
배__01/NNG	고아원/NNG 에/JKB 들어가/VV ᆫ/ETM 직후/NNG ,/SP 	배/NNG	가/JKS 고프/VA 아서/EC 남몰래/MAG 부엌/NNG 에/JKB 숨어들/VV 었/EP 으나/EC 밥/NNG 은/JX 찾/VV 지/EC 못하/VX 고/EC 김치/NNG 를/JKO 겨우/MAG 찾아내/VV 어/EC 게걸스레/MAG 훔치/VV 어/EC 먹/VV 다가/EC 
배__01/NNG		배/NNG	가/JKS 고프/VA 아/EC 오/VX 았/EP 다/EF ./SF 
배__01/NNG	눈/NNG 한번/NNG 붙이/VV 지/EC 못하/VX ᆫ/ETM 채/NNB 초조감/NNG 속/NNG 에서/JKB 밤/NNG 을/JKO 꼬박/MAG 새우/VV ᆫ/ETM 뒤/NNG 	배/NNG	에/JKB 든든히/MAG 밥/NNG 이/JKS 들어가/VV 자/EC ,/SP 그리고/MAJ 병식이/NNP 형/NNG 을/JKO 만나/VV 자/EC 긴장감/NNG 이/JKS 풀리/VV 면서/EC 걷잡/VV 을/ETM 수/NNB 없이/MAG 졸음/NNG 이/JKS 쏟아지/VV 었/EP 
배__01/NNG	그/NP 의/JKG 구둣발/NNG 이/JKS 	배/NNG	로/JKB 날아들/VV 었/EP 다/EF ./SF 
배__01/NNG	아마도/MAG 그/MM 공짜/NNG 로/JKB 얻어먹/VV 은/ETM 밥/NNG 과/JC 술/NNG 이/JKS 인연/NNG 이/JKC 되/VV 어/EC 아비/NNG 와/JC 어미/NNG 는/JX 머지않/VA 아/EC 	배/NNG	가/JKS 맞/VV 았/EP 고/EC ,/SP 살림/NNG 까지/JX 차리/VV 게/EC 되/VV 었/EP 다/EC 살림/NNG 이/VCP 라고/EC 하/VV 아/EC 보/VX 아야/EC 시장/NNG 바닥/NNG 에서/JKB 숟가락/NNG 젓가락/NNG 두/MM 
배__01/NNG	역시/MAG 아직/MAG 까지/JX 좋아하/VV 는/ETM 젖가슴/NNG 을/JKO 훤히/MAG 드러내/VV 어/EC 놓/VX 고/EC 한/XPN 낮/NNG 이/JKS 겹/VA 도록/EC 잠/NNG 에/JKB 빠지/VV ᆫ/ETM 어미/NNG 를/JKO 바라보/VV 다가/EC 	배/NNG	가/JKS 고프/VA 아/EC 참/VV 을/ETM 수/NNB 가/JKS 없/VA 게/EC 되/VV 면/EC 나/NP 는/JX 여기저기/NNG 쓰러지/VV 어/EC 나뒹굴/VV 는/ETM 소주병/NNG 에/JKB 남/VV 은/ETM 소주/NNG 를/JKO 핥/VV 
배__01/NNG	어미/NNG 가/JKS 울/VV 어도/EC ,/SP 	배/NNG	가/JKS 고프/VA 거나/EC 아프/VA 아도/EC 나/NP 는/JX 울/VV 지/EC 않/VX 았/EP 다/EF ./SF 
배__01/NNG	"/SS 	배/NNG	가/JKS 덜/MAG 고프/VA 았/EP 군/EF ./SF 
배__01/NNG	으으으으으아아아아아아/IC …/SE …/SE 온몸/NNG 이/JKS 커다랗/VA ᆫ/ETM 공명통/NNG (/SS 共鳴筒/SH )/SS 이/JKC 되/VV ᆫ/ETM 듯/NNB 	배/NNG	에서/JKB ,/SP 가슴/NNG 에서/JKB ,/SP 머릿속/NNG 에서/JKB 도/JX 고함/NNG 소리/NNG 가/JKS 울리/VV 어/EC 나오/VV 았/EP 다/EF ./SF 
배__01/NNG	장사/NNG 이/VCP 란/ETM 놈/NNB 허구/XR 하/XSA ᆫ/ETM 날/NNG 	배/NNG	고프/VA 다/EC 울/VV 어/EC 대/VX 면/EC 온/MM 동네/NNG 가/JKS 들썩이/VV 고/EC 에미/NNG 애비/NNG 혼/NNG 이/JKS 들락날락/MAG 몸뚱이/NNG 이/VCP 라도/EC 끓이/VV 어/EC 먹이/VV 고/EC 싶/VX 을/ETM 
배__01/NNG	서울역/NNP 에/JKB 떨어지/VV 자마자/EC 음식점/NNG 에/JKB 들어가/VV 아서/EC 	배/NNG	가/JKS 터지/VV 도록/EC 밥/NNG 을/JKO 묵/VV 고/EC 나/VX 아서/EC 나/NP 돈/NNG 없/VA 으니/EC 맘대로/MAG 하/VV 시/EP 오/EC ,/SP 하/VV 고/EC 튕기/VV 었/EP 더니/EC 음식점/NNG 주인/NNG 
배__01/NNG	그날/NNG 로/JKB 거기/NP 두목/NNG 에게/JKB 불리/VV 어/EC 가/VX 아/EC 졸개/NNG 가/JKC 되/VV 었/EP 다/EC 밥/NNG 은/JX 	배/NNG	터지/VV 게/EC 먹이/VV 어/EC 주/VX ᆯ/ETM 터/NNB 이/VCP 니까/EC 시키/VV 는/ETM 일/NNG 만/JX 제대로/MAG 하/VV 라고/EC 하/VV 더라/EF ./SF 
배__01/NNG		배/NNG	터지/VV 게/EC 먹이/VV 어/EC 주/VX ᆫ다는데/EC 그/NP 보다/JKB 고맙/VA ᆯ/ETM 데/NNB 가/JKS 어디/NP 있/VV 단/ETM 말/NNG 이/VCP 냐/EF ./SF 
배__01/NNG	어도/EC 먹/VV 는/ETM 때/NNG 보다/JKB 못/MAG 먹/VV 는/ETM 때/NNG 가/JKS 더/MAG 많/VA 았/EP 는디/EC 어떻/VA 게/EC 주먹/NNG 질/XSN 하/XSV 는/ETM 것/NNB 만/JX 으로/JKB 매일/MAG 매일/MAG 	배/NNG	터지/VV 게/EC 묵/VV 을/ETM 수/NNB 있/VV 다는/ETM 말/NNG 이/VCP ᆫ가/EC ,/SP 그런/MM 세상/NNG 이/JKS 어디/NP 있/VV 단/ETM 말/NNG 이/VCP ᆫ가/EC ,/SP 긴가민가/XR 하/XSA 았/EP 다/EF 
배__01/NNG	어찌/MAG 하/XSV 아서/EC 	배/NNG	가/JKS 고프/VA 냐/EF ?/SF 
배__03/NNG	근처/NNG 에/JKB ᆫ/JX 복숭아밭/NNG 	배/NNG	밭/NNG 이/JKS 지천/NNG 이/VCP 었/EP 어요/EF ./SF 
배__03/NNG	"/SS 그/MM 폭포/NNG 에서/JKB 흘러내리/VV ᆫ/ETM 물줄기/NNG 가/JKS 용산강/NNP 까지/JX 이어지/VV 는데/EC ,/SP 그/MM 물/NNG 위/NNG 로/JKB 복숭아/NNG 꽃잎/NNG ,/SP 	배/NNG	꽃잎/NNG 이/JKS 떨어지/VV 어/EC 흘러가/VV 면/EC 햇빛/NNG 에/JKB 반짝이/VV 는/ETM 맑/VA 은/ETM 물/NNG 에/JKB ,/SP 희/VA ᆫ/ETM 모래/NNG 에/JKB ,/SP 복숭아꽃/NNG 배꽃/NNG 이파리/NNG 에/JKB …/SE 
배__03/NNG	배꽃/NNG 이/JKS 흐르/VV 고/EC ,/SP 얼어붙/VV 은/ETM 물/NNG 속/NNG 에/JKB 가재/NNG 들/XSN 이/JKS 겨울잠/NNG 을/JKO 자/VV 고/EC ,/SP 친구/NNG 들/XSN 이/JKS 개울물/NNG 에/JKB 복숭아/NNG 랑/JC 	배/NNG	를/JKO 담그/VV 아/EC 놓/VX 고/EC 세수/NNG 를/JKO 하/VV 고/EC 발/NNG 을/JKO 씻/VV 고/EC 물놀이/NNG 를/JKO 하/VV 다가/EC 복숭아/NNG 하나/NR 배/NNG 하나/NR 건지/VV 어/EC 먹/VV 으면/EC 
배__03/NNG	이/JKS 개울물/NNG 에/JKB 복숭아/NNG 랑/JC 배/NNG 를/JKO 담그/VV 아/EC 놓/VX 고/EC 세수/NNG 를/JKO 하/VV 고/EC 발/NNG 을/JKO 씻/VV 고/EC 물놀이/NNG 를/JKO 하/VV 다가/EC 복숭아/NNG 하나/NR 	배/NNG	하나/NR 건지/VV 어/EC 먹/VV 으면/EC 그만/MAG 배/NNG 가/JKS 그들먹/XR 하/XSA 아/EC 지/VX 던/ETM 때/NNG …/SE …/SE 하지만/MAJ 그/MM 용/NNG 은/JX 떠나가/VV 아/EC 버리/VX 었/EP 어요/EF 
배__01/NNG	담그/VV 아/EC 놓/VX 고/EC 세수/NNG 를/JKO 하/VV 고/EC 발/NNG 을/JKO 씻/VV 고/EC 물놀이/NNG 를/JKO 하/VV 다가/EC 복숭아/NNG 하나/NR 배/NNG 하나/NR 건지/VV 어/EC 먹/VV 으면/EC 그만/MAG 	배/NNG	가/JKS 그들먹/XR 하/XSA 아/EC 지/VX 던/ETM 때/NNG …/SE …/SE 하지만/MAJ 그/MM 용/NNG 은/JX 떠나가/VV 아/EC 버리/VX 었/EP 어요/EF ./SF 
배__01/NNG	그/NP 는/JX 끄떡/MAG 도/JX 않/VV 고/EC 그/MM 커다랗/VA ᆫ/ETM 손/NNG 으로/JKB 나/NP 의/JKG 목/NNG 을/JKO 틀어쥐/VV ᆫ/ETM 채/NNB 	배/NNG	에/JKB ,/SP 얼굴/NNG 에/JKB ,/SP 턱/NNG 에/JKB 주먹/NNG 질/XSN 을/JKO 계속/NNG 하/XSV 았/EP 고/EC ,/SP 영순이/NNP 는/JX 술/NNG 을/JKO 급하/VA 게/EC 퍼마시/VV 었/EP 고/EC ,/SP 
배__02/NNG	나오/VV 는데/EC ,/SP 거기/NP 에서/JKB 다시/MAG 동남쪽/NNG 으로/JKB 이십이/NR 년/NNB 을/JKO 가/VV 면/EC 영혼/NNG 의/JKG 호수/NNG 가/JKS 나오/VV 고/EC ,/SP 그/MM 호수/NNG 북쪽/NNG 끝/NNG 에서/JKB 	배/NNG	를/JKO 타/VV 고/EC 서남쪽/NNG 으로/JKB 길/NNG 을/JKO 잡/VV 아/EC 오십일/NR 년/NNB 을/JKO 가/VV 면/EC 열고야/NNP 이/VCP 라는/ETM 아름답/VA ᆫ/ETM 섬/NNG 이/JKS 있/VV 어요/EF ./SF 
배__03/NNG	도/JX 한잔/NNG 하/VV 아야지/EC …/SE …/SE 그/NP 가/JKS 나가/VV ᆫ/ETM 뒤/NNG 영순이/NNP 는/JX 나/NP 를/JKO 마루/NNG 에/JKB 앉히/VV ᆫ/ETM 채/NNB 커피/NNG 를/JKO 끓이/VV ᆫ다/EC ,/SP 	배/NNG	를/JKO 깎/VV 는다/EC ,/SP 한동안/NNG 분주히/MAG 움직이/VV 다가/EC 커피/NNG 잔/NNG 을/JKO 하나/NR 깨뜨리/VV 고/EC ,/SP 당황/NNG 하/XSV 아/EC 그것/NP 을/JKO 황급히/MAG 치우/VV 고/EC 나/VV ᆫ/ETM 
배__01/NNG	차디차/VA ᆫ/ETM 해부대/NNG 위/NNG 에/JKB 사지/NNG 가/JKS 절단/NNG 되/XSV 고/EC 	배/NNG	가/JKS 갈라지/VV 어/EC 심장/NNG 과/JC 허파/NNG 와/JC 위/NNG 와/JKB 창자/NNG 를/JKO 드러내/VV ᆫ/ETM 어미/NNG 를/JKO ./SF 
배__01/NNG	내/NP 가/JKS 아무리/MAG 	배/NNG	가/JKS 고프/VA 아도/EC 양키/NNG 놈/NNB 들/XSN 좆/NNG 안/MAG 빨/VV 고/EC 살/VV 아/EC ,/SP 이/MM 새끼/NNG 야/JKV ./SF 
