배__09/NNG	이/JKS 제공/NNG 하/XSV 는/ETM 서비스/NNG 의/JKG 종류/NNG 는/JX 모두/MAG 1000/SN 여/XSN 가지/NNB 가/JKS 넘/VV 으며/EC 단/MM 1/SN 년/NNB 만/NNB 에/JKB 총/MM 사용량/NNG 이/JKS 무려/MAG 10/SN 	배/NNG	나/JX 신장/NNG 하/XSV ᆯ/ETM 만큼/NNB 획기적/NNG 이/VCP ᆫ/ETM 발전/NNG 을/JKO 보이/VV 었/EP 다/EF ./SF 
배__01/NNG	신경/NNG 조직/NNG 을/JKO 통하/VV 아/EC 척추/NNG ,/SP 내장/NNG ,/SP 혈액/NNG 등/NNB 각/MM 부위/NNG 가/JKS 연결/NNG 되/XSV 어/EC 있/VX 어/EC 등/NNG 이나/JC 허리/NNG 가/JKS 아프/VA 면/EC 	배/NNG	가/JKS 아프/VA 고/EC ,/SP 내장/NNG 이/JKS 아프/VA 면/EC 등/NNG 이/JKS 아프/VA ᆫ/ETM 증세/NNG 가/JKS 일어나/VV 기/ETN 도/JX 하/VX ᆫ다/EF ./SF 
배__01/NNG	협심증/NNG 은/JX 왼쪽/NNG 가슴/NNG 과/JC 어깨/NNG ,/SP 팔/NNG 이/JKS 당기/VV 며/EC ,/SP 췌장염/NNG 은/JX 	배/NNG	한/MM 가운데/NNG 에/JKB 해당/NNG 하/XSV 는/ETM 허리/NNG 가/JKS 아프/VA 다/EF ./SF 
배__01/NNG	⑧/SW 헛/XPN 	배/NNG	,/SP 신물/NNG ,/SP 변비/NNG ,/SP 설사/NNG ,/SP 트림/NNG 등/NNB 이/JKS 자주/MAG 일어나/VV 고/EC 가슴/NNG 이/JKS 뭉클/XR 하/XSA 고/EC 무엇/NP 이/JKS 걸리/VV 어/EC 있/VX 는/ETM 것/NNB 
배__01/NNG	자네/NP 의/JKG 그/MM 	배/NNG	를/JKO 보/VV 라구/EF ./SF 
배__01/NNG	그것/NP 이/JKS 모두/MAG 살/NNG 이/JKS 찌/VV 고/EC 	배/NNG	가/JKS 나오/VV ᆫ/ETM 탓/NNG 이/VCP 라네/EF ./SF 
배__09/NNG	참고/NNG 로/JKB 말/NNG 하/XSV 자면/EC ,/SP 비만증/NNG 이/VCP ᆫ/ETM 사람/NNG 이/JKS 성인병/NNG 으로/JKB 사망/NNG 하/XSV 는/ETM 비율/NNG 은/JX 보통/NNG 사람/NNG 보다/JKB 몇/MM 	배/NNG	나/JX 높/VA 다/EF ./SF 
배__09/NNG	뇌졸중/NNG 이/JKS 2/SN 	배/NNG	,/SP 간경변/NNG 이/JKS 4/SN 배/NNG ,/SP 당뇨병/NNG 이/JKS 무려/MAG 5/SN 배/NNG 이상/NNG 이나/JX 되/VV ᆫ다/EF ./SF 
배__09/NNG	뇌졸중/NNG 이/JKS 2/SN 배/NNG ,/SP 간경변/NNG 이/JKS 4/SN 	배/NNG	,/SP 당뇨병/NNG 이/JKS 무려/MAG 5/SN 배/NNG 이상/NNG 이나/JX 되/VV ᆫ다/EF ./SF 
배__09/NNG	뇌졸중/NNG 이/JKS 2/SN 배/NNG ,/SP 간경변/NNG 이/JKS 4/SN 배/NNG ,/SP 당뇨병/NNG 이/JKS 무려/MAG 5/SN 	배/NNG	이상/NNG 이나/JX 되/VV ᆫ다/EF ./SF 
배__01/NNG	아랫배/NNG 가/JKS 나오/VV 는/ETM 것/NNB 을/JKO 방지/NNG 하/XSV 기/ETN 위하/VV 아서/EC 는/JX 	배/NNG	의/JKG 근육/NNG 을/JKO 사용/NNG 하/XSV 는/ETM 것/NNB 으로/JKB 체조/NNG 나/JC 계단/NNG 을/JKO 오르내리/VV 는/ETM 등/NNB 의/JKG 걷/VV 는/ETM 운동/NNG 을/JKO 계속/NNG 하/XSV 아/EC 주/VX 어야/EC 
배__02/NNG	그래서/MAJ 마치/MAG "/SS 	배/NNG	가/JKS 도크/NNG 에/JKB 들어가/VV ᆫ/ETM 것/NNB 같/VA 다/EF ./SF 
배__09/NNG	혈압/NNG 만/JX 을/JKO 중요/XR 시/XSN 하/XSV 는/ETM 경향/NNG 이/JKS 있/VV 지만/EC 가령/MAG 뇌혈관/NNG 의/JKG 경우/NNG 혈관/NNG 이/JKS 건전/NNG 하/XSA 다면/EC 보통/MAG 혈압/NNG 의/JKG 10/SN 여/XSN 	배/NNG	의/JKG 압력/NNG 으로/JKB 도/JX 파열/NNG 되/XSV 지/EC 않/VX 는다는/ETM 연구/NNG 보고/NNG 가/JKS 있/VV 다/EF ./SF 
배__09/NNG	5/SN 	배/NNG	정도/NNG 이/VCP 라는/ETM 수치/NNG 가/JKS 나오/VV 았/EP 다/EF ./SF 
배__09/NNG	1/SN 	배/NNG	,/SP 10/SN ~/SO 20/SN 퍼센트/NNG 를/JKO 초과/NNG 하/XSV ᆫ/ETM 비만/NNG 군/NNG 에서/JKB 는/JX 2/SN ./SF 
배__09/NNG	4/SN 	배/NNG	나/JX 고/XPN 혈압/NNG 위험도/NNG 가/JKS 높/VA 다는/ETM 결론/NNG 이/JKS 나오/VV 았/EP 다/EF ./SF 
배__09/NNG	이/NP 는/JX 심장/NNG 이/JKS 다른/MM 기관/NNG 이나/JC 조직/NNG 에서/JKB 필요/NNG 로/JKB 하/VV 는/ETM 영양분/NNG 의/JKG 10/SN 	배/NNG	나/JX 되/VV 는/ETM 영양분/NNG 을/JKO 소비/NNG 하/XSV 고/EC 있/VX 다는/ETM 것/NNB 을/JKO 뜻/NNG 하/XSV 는/ETM 것/NNB 이/VCP 다/EF ./SF 
배__01/NNG	위궤양/NNG 과/JC 십이지장/NNG 궤양/NNG 은/JX 트림/NNG 과/JC 가슴앓이/NNG 이외/NNG 에/JKB 음식/NNG 을/JKO 먹/VV 으면/EC 	배/NNG	가/JKS 아프/VA 아/EC 지/VX 기/ETN 때문/NNB 에/JKB 식욕/NNG 이/JKS 뚝/MAG 떨어지/VV ᆫ다/EF ./SF 
배__09/NNG	에/JKB 걸리/VV 면/EC 완치/NNG 되/XSV 지/EC 않/VX 을/ETM 뿐/NNB 아니/VCN 라/EC 치료/NNG 기간/NNG 도/JX 흡연/NNG 을/JKO 하/VV 지/EC 않/VX 는/ETM 사람/NNG 보다/JKB 3/SN ~/SO 4/SN 	배/NNG	의/JKG 오랜/MM 기간/NNG 이/JKS 필요/NNG 하/XSA 다/EF ./SF 
배__01/NNG	오랫동안/NNG 소화/NNG 가/JKS 안/MAG 되/VV 고/EC 헛/XPN 	배/NNG	가/JKS 부르/VV 고/EC 변비/NNG 나/JC 설사/NNG 가/JKS 나/VV 는/ETM 환자/NNG 를/JKO 대하/VV 다/EC 보/VX 면/EC 정작/NNG 소화/NNG 기관/NNG 은/JX 이상/NNG 이/JKS 없/VA 지만/EC ,/SP 다른/MM 
배__01/NNG	장간막/NNG 혈전증/NNG (/SS 피/NNG 가/JKS 엉기/VV ᆫ/ETM 경우/NNG )/SS 이/JKS 있/VV 을/ETM 때/NNG 소화/NNG 기관/NNG 에/JKB 울혈/NNG 이/JKS 생기/VV 고/EC 식욕/NNG 이/JKS 떨어지/VV 고/EC 헛/XPN 	배/NNG	가/JKS 부르/VV 고/EC 변비/NNG 등/NNB 이/JKS 지속/NNG 되/XSV ᆫ다/EF ./SF 
배__09/NNG	한창/MAG 일/NNG 하/XSV ᆯ/ETM 나이/NNG 이/VCP ᆫ/ETM 40/SN ~/SO 50/SN 대/NNB 의/JKG 남성/NNG 에게/JKB 많/VA 은/ETM 것/NNB (/SS 여성/NNG 의/JKG 2/SN 	배/NNG	)/SS 을/JKO 보/VV 아도/EC 그/NP 들/XSN 이/JKS 얼마나/MAG 간장/NNG 을/JKO 혹사/NNG 시키/XSV 었/EP 는가/EC 하/VV 는/ETM 것/NNB 을/JKO 짐작/NNG 하/XSV ᆯ/ETM 수/NNB 있/VV 다/EF ./SF 
배__01/NNG	이/NP 밖에/JX 간경화증/NNG 이/JKS 심하/VA 아/EC 지/VX 면/EC 	배/NNG	에/JKB 물/NNG 이/JKS 차/VV 고/EC ,/SP 알부민/NNG 부족/NNG 등/NNB 혈액/NNG 상/XSN 의/JKG 이상/NNG 이/JKS 나타나/VV ᆫ다/EF ./SF 
배__01/NNG	또/MAJ 장딴지/NNG 가/JKS 붓/VV 고/EC 	배/NNG	(/SS 배꼽/NNG 상부/NNG )/SS 에/JKB 거미줄/NNG 모양/NNG 의/JKG 혈관종/NNG 이/JKS 드러나/VV ᆫ다/EF ./SF 
배__01/NNG	술/NNG 을/JKO 많이/MAG 마시/VV 는/ETM 사람/NNG 의/JKG 얼굴/NNG 이/JKS 검/VA 어/EC 지/VX 거나/EC ,/SP 	배/NNG	가/JKS 항상/MAG 부르/VV 고/EC ,/SP 배/NNG 에/JKB 물/NNG 이/JKS 가득/MAG 하/XSA ᆫ/ETM 느낌/NNG (/SS 복수/NNG 현상/NNG )/SS 이/JKS 들/VV 며/EC ,/SP 성욕/NNG 이/JKS 감퇴/NNG 되/XSV 
배__01/NNG	술/NNG 을/JKO 많이/MAG 마시/VV 는/ETM 사람/NNG 의/JKG 얼굴/NNG 이/JKS 검/VA 어/EC 지/VX 거나/EC ,/SP 배/NNG 가/JKS 항상/MAG 부르/VV 고/EC ,/SP 	배/NNG	에/JKB 물/NNG 이/JKS 가득/MAG 하/XSA ᆫ/ETM 느낌/NNG (/SS 복수/NNG 현상/NNG )/SS 이/JKS 들/VV 며/EC ,/SP 성욕/NNG 이/JKS 감퇴/NNG 되/XSV 고/EC ,/SP 탈모/NNG 증상/NNG 이/JKS 오/VV 
배__09/NNG	5/SN 	배/NNG	,/SP 그리고/MAJ 하루/NNG 에/JKB 50/SN 개비/NNG 이상/NNG 을/JKO 피우/VV 는/ETM 사람/NNG 은/JX 5/SN ./SF 
배__09/NNG	8/SN 	배/NNG	의/JKG 폐암/NNG 사망/NNG 률/XSN 이/JKS 나타나/VV 았/EP 으며/EC 동시/NNG 에/JKB 담배/NNG 를/JKO 끊/VV 고/EC 해/NNG 가/JKS 지나/VV ᆯ수록/EC 위험/NNG 성/XSN 이/JKS 줄어들/VV 는/ETM 사실/NNG 도/JX 
배__01/NNG	설령/MAG 증세/NNG 가/JKS 있/VV 다고/EC 하/VV 아도/EC 몸/NNG 이/JKS 나른/XR 하/XSA 다/EC ,/SP 쉽/VA 게/EC 지치/VV ᆫ다/EC ,/SP 	배/NNG	가/JKS 더부룩/XR 하/XSA 다/EC ,/SP 식욕/NNG 이/JKS 감퇴/NNG 되/XSV ᆫ다는/ETM 등/NNB 의/JKG 막연/XR 하/XSA ᆫ/ETM 증상/NNG 이/JKS 나타나/VV ᆯ/ETM 뿐/NNB 이/VCP 다/EF ./SF 
배__01/NNG	셋째/NR ,/SP 	배/NNG	가/JKS 80/SN 퍼센트/NNG 정도/NNG 만/JX 차/VV 도록/EC 먹/VV 는다/EC (/SS 과식/NNG 하/XSV 면/EC 직장/NNG 이/JKS 울혈/NNG 되/XSV ᆫ다/EC )/SS ./SF 
배__01/NNG	이/JKS 둔화/NNG 되/XSV 면서/EC 동시/NNG 에/JKB 이상/XR 하/XSA ᆫ/ETM 자극/NNG 의/JKG 감각/NNG 도/JX 수반/NNG 되/XSV 고/EC 손끝/NNG ,/SP 발끝/NNG ,/SP 팔/NNG 의/JKG 부분/NNG 때로/MAG 는/JX 	배/NNG	나/JX 등/NNG 에/JKB 까지/JX 저리/VA ᆫ/ETM 느낌/NNG 이/JKS 원인/NNG 없이/MAG 길/VA 게/EC 지속/NNG 되/XSV 기/ETN 도/JX 하/VX ᆫ다/EF ./SF 
배__09/NNG	9/SN 	배/NNG	하/VV ᆫ/ETM 것/NNB 이/VCP 라고/EC 알리/VV 어/EC 지/VX 어/EC 있/VX 다/EF ./SF 
배__09/NNG	85/SN 	배/NNG	하/VV 지/EC 않/VX 으면/EC 안/MAG 되/VV 고/EC ,/SP 키/NNG 가/JKS 작/VA 은/ETM 경우/NNG 는/JX 0/SN ./SF 
배__09/NNG	95/SN 	배/NNG	하/VV 아야/EC 적당/XR 하/XSA 다/EF ./SF 
배__09/NNG	그/MM 결과/NNG 두/MM 번/NNB 에/JKB 나누/VV 어/EC 먹이/VV ᆫ/ETM 동물/NNG 의/JKG 지방량/NNG 이/JKS 하루/NNG 여러/MM 차례/NNG 에/JKB 걸치/VV 어/EC 먹이/VV ᆫ/ETM 경우/NNG 보다/JKB 두/MM 	배/NNG	나/JX 많/VA 았/EP 다/EF ./SF 
배__01/NNG	중년/NNG 의/JKG 경우/NNG 에/JKB 는/JX 여기/NP 에서/JKB 주로/MAG 유연체조/NNG 와/JC 	배/NNG	·/SP 등/NNG 의/JKG 근육/NNG 운동/NNG 및/MAJ 달리기/NNG 5/SN 킬로미터/NNB 정도/NNG 를/JKO 하/VV 는/ETM 것/NNB 이/JKS 알맞/VA 다/EF ./SF 
배__09/NNG	하루/NNG 14/SN 그램/NNB 이하/NNG 로/JKB 소금/NNG 을/JKO 적/VA 게/EC 먹/VV 는/ETM 서부/NNG 주민/NNG 들/XSN 의/JKG 고/XPN 혈압/NNG 발생/NNG 률/XSN 은/JX 24/SN 퍼센트/NNG 로서/JKB 약/MM 2/SN 	배/NNG	의/JKG 차이/NNG 가/JKS 나/VV ᆫ다고/EC 하/VV ᆫ다/EF ./SF 
배__01/NNG	➎/SW 	배/NNG	가/JKS 고프/VA ᆯ/ETM 때/NNG 및/MAJ 격렬/XR 하/XSA ᆫ/ETM 운동/NNG 을/JKO 하/VV ᆫ/ETM 뒤/NNG 에/JKB 는/JX 담배/NNG 를/JKO 금하/VV ᆫ다/EF ./SF 
배__09/NNG	{/SS 부활/NNP }/SS 자체/NNG 가/JKS 결코/MAG 짧/VA 은/ETM 소설/NNG 이/JKC 아니/VCN ᆫ데/EC {/SS 안나/NNP 가레니나/NNP }/SS 는/JX 그것/NP 의/JKG 약/MM 2/SN 	배/NNG	,/SP {/SS 전쟁/NNG 과/JC 평화/NNG }/SS 는/JX 약/MM 3/SN 배/NNG 나/JX 되/VV 는/ETM 길이/NNG 이/VCP ᆫ/ETM 것/NNB 이/VCP 다/EF ./SF 
배__09/NNG	짧/VA 은/ETM 소설/NNG 이/JKC 아니/VCN ᆫ데/EC {/SS 안나/NNP 가레니나/NNP }/SS 는/JX 그것/NP 의/JKG 약/MM 2/SN 배/NNG ,/SP {/SS 전쟁/NNG 과/JC 평화/NNG }/SS 는/JX 약/MM 3/SN 	배/NNG	나/JX 되/VV 는/ETM 길이/NNG 이/VCP ᆫ/ETM 것/NNB 이/VCP 다/EF ./SF 
배__03/NNG	은/JX 거의/MAG 떨어지/VV 었/EP 다/EC 하/VV ᆯ/ETM 수/NNB 있/VV 고/EC 사람/NNG 들/XSN 이/JKS 모이/VV 어/EC 떠들썩/XR 하/XSA 고/EC ,/SP 떡/MAG ,/SP 과술/NNG ,/SP 밤/NNG ,/SP 	배/NNG	먹/VV 을/ETM 것/NNB 이/JKS 많/VA 아/EC 어린아이/NNG 를/JKO 붙들/VV 어/EC 놓/VX 기에/EC 는/JX 십상/MAG 좋/VA 은/ETM 기회/NNG 이/VCP 었/EP 다/EF ./SF 
배__09/NNG	불교/NNG 이/VCP ᆯ까/EC (/SS [/SS 열반/NNG 의/JKG 	배/NNG	]/SS )/SS ,/SP 혹은/MAG 아직/MAG 도/JX 알/VV ᆯ/ETM 수/NNB 없/VA 는/ETM 것/NNB 이/VCP ᆫ가/EF ./SF 
배__01/NNG	손/NNG 으로/JKB 하루/NNG 아침/NNG 에/JKB 허물/VV 어/EC 주/VX 시/EP ᄇ시오/EC 다만/MAG 하나/NR 이/VCP 고서/EC 둘/NR 이/JKC 되/VV ᆯ/ETM 수/NNB 없/VA 는/ETM 국토/NNG 를/JKO 아프/VA ᆫ/ETM 	배/NNG	부비/VV 어/EC 주/VX 시/EP 는/ETM 약손/NNG 같이/JKB 그렇/VA 게/EC 자애/NNG 롭/XSA 게/EC 쓸/VV 어/EC 주/VX 시/EP ᄇ시오/EF ./SF 
배__01/NNG	모든/MM 현재/NNG 적/XSN 이/VCP ᆫ/ETM 비평/NNG ,/SP 그러니까/MAJ 파충류/NNG 모양/NNG 땅바닥/NNG 에/JKB 	배/NNG	를/JKO 깔/VV 고/EC 기/VV 고/EC 있/VX 는/ETM 비평/NNG 이/JKS 땅/NNG 에서/JKB 발/NNG 을/JKO 떼/VV 어/EC 비상/NNG 하/XSV 게/EC 되/VV 는/ETM 것/NNB 은/JX 문학사/NNG 의/JKG 힘/NNG 
배__03/NNG	영재/NNP ,/SP 그/MM 친구/NNG 가/JKS 뭔/MM 맘/NNG 으로/JKB 남/NNG 의/JKG 잔치/NNG 에/JKB 	배/NNG	놓/VV 아라/EC 감/NNG 놓/VV 아라/EC 하/VV 는지/EC ᆫ/JX 모르/VV 겠/EP 지만/EC 어쭙/VA 지/EC 않/VX 아/EC 내/NP 가/JKS 한마디/NNG 하/VV 아/EC 주/VX 었/EP 소/EF ./SF 
배__02/NNG	흔히/MAG 사공/NNG 이/JKS 많/VA 으면/EC 	배/NNG	가/JKS 산/NNG 으로/JKB 오르/VV ᆫ다든가/EC ,/SP 방/NNG 속/NNG 에서/JKB 의/JKG 헤엄치/VV 기/ETN 따위/NNB 로/JKB 빈축/NNG 을/JKO 사/VV 게/EC 되/VV ᄆ/ETN 이/JKS 방법/NNG 론/XSN 논의/NNG 의/JKG 
배__02/NNG	어느/MM 날/NNG 새벽/NNG 그/NP 가/JKS 	배/NNG	를/JKO 손질/NNG 하/XSV 고/EC 있/VX 는데/EC ,/SP 머리/NNG 가/JKS 하얗/VA ᆫ/ETM 미치광이/NNG [/SS 白首狂夫/SH ]/SS 가/JKS 머리/NNG 를/JKO 풀/VV 어/EC 헤치/VV ᆫ/ETM 채/NNB 술병/NNG 을/JKO 
배__02/NNG	그리고/MAJ 	배/NNG	에/JKB 실리/VV 어/EC 강/NNG 을/JKO 건너/VV 던/ETM 아내/NNG 가/JKS 그/NP 에/JKB 답/NNG 하/XSV ᆫ/ETM 노래/NNG 가/JKS [/SS 예성강/NNP 후편/NNG ]/SS 으로/JKB ,/SP 이/MM 노래/NNG 가/JKS 
배__02/NNG	특히/MAG '/SS 	배/NNG	뜨/VV 어라/EC 배/NNG 뜨/VV 어라/EC '/SS 혹은/MAG '/SS 닫/NNG 들/VV 어라/EC 닫/NNG 들/VV 어라/EC '/SS 등/NNB 의/JKG 조흥구/NNG 역시/MAG 무/XPN 의미/NNG 하/XSA 게/EC 사용/NNG 되/XSV 
배__02/NNG	특히/MAG '/SS 배/NNG 뜨/VV 어라/EC 	배/NNG	뜨/VV 어라/EC '/SS 혹은/MAG '/SS 닫/NNG 들/VV 어라/EC 닫/NNG 들/VV 어라/EC '/SS 등/NNB 의/JKG 조흥구/NNG 역시/MAG 무/XPN 의미/NNG 하/XSA 게/EC 사용/NNG 되/XSV ᆫ/ETM 것/NNB 이/JKC 
배__02/NNG	들/VV 어라/EC '/SS 등/NNB 의/JKG 조흥구/NNG 역시/MAG 무/XPN 의미/NNG 하/XSA 게/EC 사용/NNG 되/XSV ᆫ/ETM 것/NNB 이/JKC 아니/VCN 고/EC '/SS 기슭/NNG 에/JKB 대/VV 어/EC 있/VX 는/ETM 	배/NNG	를/JKO 바다/NNG 에/JKB 띄우/VV 어서/EC 닻/NNG 을/JKO 들/VV 고/EC 돛/NNG 을/JKO 달/VV 아/EC ,/SP 젓/VV 고/EC 젓/VV 어서/EC 저편/NP 에/JKB 이르/VV 어/EC 배/NNG 를/JKO 붙이/VV 
배__02/NNG	있/VX 는/ETM 배/NNG 를/JKO 바다/NNG 에/JKB 띄우/VV 어서/EC 닻/NNG 을/JKO 들/VV 고/EC 돛/NNG 을/JKO 달/VV 아/EC ,/SP 젓/VV 고/EC 젓/VV 어서/EC 저편/NP 에/JKB 이르/VV 어/EC 	배/NNG	를/JKO 붙이/VV ᆯ/ETM 때/NNG '/SS 까지/JX 의/JKG 시간/NNG 적/XSN 경과/NNG 에/JKB 맞/VV 게/EC 짜이/VV 어/EC 지/VX 어/EC 있/VX 다/EF ./SF 
배__02/NNG	청명/XR 하/XSA ᆫ/ETM 봄볕/NNG 아래/NNG 잔잔히/MAG 펼쳐지/VV 어/EC 있/VX 는/ETM 물결/NNG ,/SP 그/MM 위/NNG 에/JKB 뜨/VV 어/EC 있/VX 는/ETM 작/VA 은/ETM 	배/NNG	,/SP 이/MM 장면/NNG 의/JKG 티/NNG 없/VA 는/ETM 아름답/VA ᄆ/ETN 에/JKB 도취/NNG 하/XSV 아/EC 그물/NNG 을/JKO 치/VV 거나/EC 낚시/NNG 질/XSN 조차/JX 잊/VV 어/EC 버리/VX ᆫ/ETM 시/NNG 
배__02/NNG	나/NP 는/JX 무령산/NNP 을/JKO 돌/VV 아/EC 	배/NNG	로/JKB 광형하/NNP 를/JKO 건너/VV 어/EC 밤/NNG 에/JKB 고북구/NNP 를/JKO 나서/VV 었/EP 는데/EC ,/SP 때/NNG 는/JX 밤/NNG 도/JX 이미/MAG 삼경/NNG 이/VCP 었/EP 다/EF ./SF 
배__01/NNG	남/NNG 이/JKS 잘/MAG 되/XSV 는/ETM 꼴/NNG 은/JX 	배/NNG	가/JKS 아프/VA 아/EC ,/SP 더더욱/MAG 눈/NNG 뜨/VV 고/EC 보/VV 지/EC 못하/VX 았/EP 다/EF ./SF 
배__09/NNG	놀부/NNP 보다/JKB 몇/MM 	배/NNG	부자/NNG 가/JKC 되/VV ᆫ/ETM 흥부/NNP 의/JKG 태도/NNG 를/JKO 보/VV 자/EF ./SF 
배__09/NNG	흥부/NNP 박/NNG 이/JKS 세/MM 통/NNG 에/JKB 지나/VV 지/EC 않/VX 는/ETM 데/NNB 비하/VV 아/EC ,/SP 너/NP 의/JKG 	배/NNG	가/JKS 넘/VV 는/ETM 박/NNG 을/JKO 설정/NNG 하/XSV ᆫ/ETM 것/NNB 에서/JKB 놀부/NNP 를/JKO 징치/NNG 하/XSV 고자/EC 하/VX 았/EP 던/ETM 민중/NNG 의/JKG 적대감/NNG 을/JKO 엿보/VV ᆯ/ETM 수/NNB 
배__09/NNG	이제/MAG 그/NP 들/XSN 개개인/NNG 이/JKS 당하/VV 았/EP 던/ETM 수모/NNG 를/JKO ,/SP 수백/NR 수천/NR 명/NNB 이/JKS 함께/MAG 모이/VV 어/EC 비로소/MAG 몇/MM 	배/NNG	로/JKB 분풀이/NNG 하/XSV ᆯ/ETM 수/NNB 있/VV 었/EP 던/ETM 것/NNB 이/VCP 다/EF ./SF 
배__01/NNG	년/NNB 을/JKO 기한/NNG 으로/JKB ,/SP 부부/NNG 관계/NNG 마저/JX 포기/NNG 하/XSV ᆫ/ETM 채/NNB 각/MM 방/NNG 을/JKO 쓰/VV 고/EC ,/SP 하루/NNG 에/JKB 죽/NNG 한/MM 그릇/NNG 만/JX 으로/JKB 	배/NNG	를/JKO 채우/VV 는/ETM 등/NNB 처절/NNG 하/XSA 게/EC 살림/NNG 을/JKO 모으/VV ᆫ/ETM 결과/NNG 도/NNG 내/NNB 갑부/NNG 가/JKC 되/VV 기에/EC 이르/VV ᆫ다/EF ./SF 
배__01/NNG	양식/NNG 풍성/XR 하/XSA 다/EC "/SS 고/JKQ 하/VV 아/EC 피폐/NNG 하/XSV ᆫ/ETM 농가/NNG 의/JKG 모습/NNG 과/JC 그/NP 같/VA 은/ETM 농민/NNG 들/XSN 의/JKG 굶주림/NNG 위/NNG 에서/JKB 자기/NP 	배/NNG	를/JKO 살찌우/VV 는/ETM 관리/NNG 의/JKG 탐욕/NNG 스럽/XSA ᆫ/ETM 생활/NNG 을/JKO 대조/NNG 적/XSN 으로/JKB 묘사/NNG 하/XSV 기/ETN 도/JX 하/VX 았/EP 다/EF ./SF 
배__01/NNG		배/NNG	가/JKS 불룩/MAG 하/XSA ᆫ/ETM 것/NNB 만/JX 보/VV 고도/EC 이름/NNG 을/JKO 짓/VV 으며/EC 여자/NNG 를/JKO 남자/NNG 로/JKB 바꾸/VV 기/ETN 도/JX 하/VX 고/EC ,/SP 더/MAG 심하/VA ᆫ/ETM 
배__02/NNG	예컨대/MAG 1817/SN 년/NNB '/SS 전주/NNP 고변/NNG (/SS 告變/SH )/SS '/SS 의/JKG 주동자/NNG 들/XSN 은/JX '/SS 홍경래/NNP 가/JKS 죽/VV 지/EC 않/VX 고/EC 살/VV 아/EC 있/VX 는데/EC 	배/NNG	를/JKO 타/VV 고/EC 오/VV 아서/EC 호응/NNG 하/XSV ᆫ다/EC '/SS 는/ETM 말/NNG 로/JKB 민심/NNG 을/JKO 선동/NNG 하/XSV 고/EC 있/VX 으며/EC ,/SP 1826/SN 년/NNB '/SS 청주/NNP 괘서/NNG 
배__02/NNG		배/NNG	나/JX 마차/NNG 가/JKS 있/VV 어도/EC 타/VV ᆯ/ETM 필요/NNG 가/JKS 없/VA 고/EC ,/SP 갑옷/NNG 과/JC 무기/NNG 가/JKS 있/VV 어도/EC 쓰/VV ᆯ/ETM 일/NNG 이/JKS 없/VA 다/EF ./SF 
배__09/NNG	총명/NNG 과/JC 지혜/NNG 를/JKO 끊/VV 어/EC 버리/VX 면/EC 백성/NNG 의/JKG 이익/NNG 이/JKS 백/NR 	배/NNG	로/JKB 늘어나/VV ᆯ/ETM 것/NNB 이/VCP 다/EF ./SF 
배__01/NNG	그러므로/MAJ 성인/NNG 의/JKG 다스리/VV ᄆ/ETN 은/JX 마음/NNG 을/JKO 비우/VV 고/EC 	배/NNG	를/JKO 채우/VV 며/EC ,/SP 의욕/NNG 을/JKO 줄이/VV 고/EC 뼈/NNG 를/JKO 튼튼히/MAG 하/VV 아/EC 늘/MAG 백성/NNG 들/XSN 이/JKS 무지/NNG 하/XSA 고/EC 욕심/NNG 이/JKS 없/VA 게/EC 만들/VV 
배__02/NNG	나/NP 는/JX 해전/NNG 에서/JKB 상대방/NNG 의/JKG 	배/NNG	를/JKO 잡아당기/VV 는/ETM 갈쿠리/NNG 와/JC 상대방/NNG 의/JKG 배/NNG 가/JKS 접근/NNG 하/XSV 지/EC 못하/VX 도록/EC 밀어내/VV 는/ETM 밀대/NNG 를/JKO 만들/VV 었/EP 습니다/EF ./SF 
배__02/NNG	나/NP 는/JX 해전/NNG 에서/JKB 상대방/NNG 의/JKG 배/NNG 를/JKO 잡아당기/VV 는/ETM 갈쿠리/NNG 와/JC 상대방/NNG 의/JKG 	배/NNG	가/JKS 접근/NNG 하/XSV 지/EC 못하/VX 도록/EC 밀어내/VV 는/ETM 밀대/NNG 를/JKO 만들/VV 었/EP 습니다/EF ./SF 
배__01/NNG	"/SS 야외/NNG 로/JKB 소풍/NNG 가/VV 는/ETM 이/NNB 는/JX 세/MM 끼/NNG 먹/VV 고/EC 돌아오/VV 아도/EC 	배/NNG	가/JKS 부르/VV 며/EC ,/SP 백/NR 리/NNB 를/JKO 가/VV 는/ETM 이/NNB 는/JX 밤새/NNG 양식/NNG 을/JKO 찧/VV 고/EC ,/SP 천/NR 리/NNB 를/JKO 가/VV 는/ETM 자/NNB 는/JX 석/MM 
배__02/NNG	"/SS 왜/MAG 호수/NNG 에/JKB 띄우/VV 어/EC 놓/VX 고/EC 	배/NNG	처럼/JKB 쓰/VV 지/EC 않/VX 느냐/EF ./SF 
배__02/NNG	그리고/MAJ 백성/NNG 들/XSN 을/JKO 	배/NNG	를/JKO 띄우/VV 는/ETM 물/NNG 에/JKB 비유/NNG 하/XSV 았/EP 습니다/EF ./SF 
배__02/NNG	그래서/MAJ 백성/NNG 을/JKO 위하/VV 지/EC 않/VX 는/ETM 군주/NNG 는/JX 물/NNG 이/JKS 	배/NNG	를/JKO 뒤엎/VV 듯이/EC 혁명/NNG 하/XSV 아야/EC 하/VX ᆫ다고/EC 하/VV 았/EP 습니다/EF ./SF 
배__02/NNG	시체/NNG 가/JKS 물/NNG 에/JKB 떠내려가/VV 다가/EC 하류/NNG 에/JKB 이르/VV 었/EP 을/ETM 때/NNG ,/SP 마침/MAG 	배/NNG	를/JKO 띄우/VV 려던/ETM 사공/NNG 이/JKS 시체/NNG 를/JKO 발견/NNG 하/XSV 고/EC 는/JX 건지/VV 어/EC 내/VX 었/EP 습니다/EF ./SF 
배__02/NNG	839/SN 년/NNB 견당사/NNG 일행/NNG 은/JX ,/SP 황해/NNP 를/JKO 건너/VV 어/EC 일본/NNP 으로/JKB 가/VV 는/ETM 	배/NNG	도/JX 없/VA 었/EP 지만/EC ,/SP 가/VV ᆯ/ETM 때/NNG 의/JKG 실패/NNG 를/JKO 거울삼/VV 아/EC 안전/NNG 을/JKO 도모/NNG 하/XSV 아/EC 신라/NNP 서/JKB ᆫ/JX 아홉/NR 척/NNB 으로/JKB 귀국/NNG 
배__02/NNG	이/NP 들/XSN 모두/NNG 가/JKS 무사히/MAG 북/NNG 규슈/NNP 에/JKB 도착/NNG 하/XSV 았/EP 고/EC ,/SP 또/MAG 아무런/MM 사고/NNG 없이/MAG 이/MM 	배/NNG	들/XSN 은/JX 전부/MAG 중국/NNP 으로/JKB 돌아가/VV 았/EP 다/EF ./SF 
배__02/NNG	그/MM 후/NNG 고려/NNP 시대/NNG 의/JKG 	배/NNG	의/JKG 속도/NNG 에/JKB 대하/VV 아서/EC 는/JX "/SS 송나라/NNP 까지/JX 는/JX 3/SN 일/NNB ,/SP 일본/NNP 에/JKB 는/JX 아침/NNG 에/JKB 출범/NNG 하/XSV 면/EC 저녁/NNG 에/JKB 는/JX 도착/NNG 
배__02/NNG	아홉/NR 척/NNB 의/JKG 	배/NNG	와/JC 60/SN 명/NNB 의/JKG 뱃사람/NNG 을/JKO 즉각/MAG 동원/NNG 하/XSV ᆯ/ETM 수/NNB 있/VV 었/EP 던/ETM 일/NNG 이/JKS 당시/NNG 의/JKG 신라/NNP 해운/NNG ./SF 
배__02/NNG	이/MM 나뭇잎/NNG 으로/JKB 	배/NNG	를/JKO 만들/VV 어/EC 띄우/VV 어/EC 가지/VX 고/EC 누구/NP 가/JKS 먼저/MAG 가/VV ᆯ/ETM 것/NNB 이/VCP ᆫ지/EC 점/NNG 을/JKO 치/VV 어/EC 보/VX 자/EF ./SF 
배__02/NNG	"/SS 그러/VV 자/EC 대세/NNG 가/JKS 만들/VV ᆫ/ETM 나뭇잎/NNG 	배/NNG	가/JKS 갑자기/MAG 일어서/VV 더니/EC 그/NP 를/JKO 향하/VV 아/EC 오/VV 는/ETM 것/NNB 이/JKC 아니/VCN ᆫ가/EF !/SF 
배__02/NNG	마침내/MAG 이/NP 들/XSN 두/MM 사람/NNG 은/JX 남해/NNP 에서/JKB 	배/NNG	를/JKO 타/VV 고/EC 바다/NNG 로/JKB 나가/VV 았/EP 다/EF ./SF 
배__02/NNG	{/SS 송사/NNP }/SS 고려전/NNP 에/JKB 는/JX "/SS 송/NNP 의/JKG 많/VA 은/ETM 귀화인/NNG 이/JKS 개경/NNP 에/JKB 살/VV 았/EP 고/EC 많/VA 은/ETM 자/NNB 들/XSN 이/JKS 	배/NNG	로/JKB 내왕/NNG 하/XSV 았/EP 다/EC "/SS 라고/JKQ 되/VV 어/EC 있/VX 어서/EC 비교/NNG 적/XSN 자유/NNG 롭/XSA 게/EC 송/NNP 과/JKB 고려/NNP 사이/NNG 를/JKO 내왕/NNG 하/XSV 았/EP 음/ETN 
배__02/NNG		배/NNG	의/JKG 크기/NNG 는/JX 2/SN ,/SP 3/SN 천/NR 섬/NNB 을/JKO 싣/VV 을/ETM 만/NNB 하/XSA 았/EP 다/EF ./SF 
배__02/NNG	박동/NNG 으로/JKB 	배/NNG	전체/NNG 의/JKG 나무판/NNG 을/JKO 싸/VV 았/EP 으며/EC ,/SP 배/NNG 안/NNG 은/JX 순동/NNG …/SE ./SF 
배__02/NNG	박동/NNG 으로/JKB 배/NNG 전체/NNG 의/JKG 나무판/NNG 을/JKO 싸/VV 았/EP 으며/EC ,/SP 	배/NNG	안/NNG 은/JX 순동/NNG …/SE ./SF 
배__02/NNG		배/NNG	위/NNG 에/JKB 는/JX 대소/NNG 8/SN ,/SP 9/SN 개/NNB 의/JKG 견고/XR 하/XSA ᆫ/ETM 돛대/NNG 를/JKO 세우/VV 었/EP 고/EC 배/NNG 앞뒤/NNG 에/JKB 는/JX 판대기/NNG 로/JKB 막/VV 은/ETM 
배__02/NNG	배/NNG 위/NNG 에/JKB 는/JX 대소/NNG 8/SN ,/SP 9/SN 개/NNB 의/JKG 견고/XR 하/XSA ᆫ/ETM 돛대/NNG 를/JKO 세우/VV 었/EP 고/EC 	배/NNG	앞뒤/NNG 에/JKB 는/JX 판대기/NNG 로/JKB 막/VV 은/ETM 누실/NNG 이/JKS 많/VA 았/EP 고/EC 창/NNG 에/JKB 는/JX 모두/MAG 유리/NNG 를/JKO 끼우/VV 었/EP 고/EC 선미/NNG 에/JKB 는/JX 대포/NNG 
배__02/NNG	이것/NP 의/JKG 정체/NNG 가/JKS 네덜란드/NNP 	배/NNG	이/VCP 라는/ETM 것/NNB 을/JKO 알리/VV 어/EC 주/VX ᆫ/ETM 것/NNB 은/JX 왜관/NNG 의/JKG 일본인/NNG 이/VCP 었/EP 다/EF ./SF 
배__02/NNG	하물며/MAJ 	배/NNG	로/JKB 바다/NNG 를/JKO 건너가/VV ᄆ/ETN 은/JX 해풍/NNG 을/JKO 기대/NNG 하/XSV ᆯ/ETM 수/NNB 없/VA 고/EC 손해/NNG 를/JKO 예측/NNG 하/XSV ᆯ/ETM 수/NNB 도/JX 없/VA 읍니다/EF ./SF 
배__02/NNG	일본/NNP 에서/JKB 출판/NNG 되/XSV 고/EC 있/VX 는/ETM 책/NNG 중/NNB 에/JKB 한국/NNP 것/NNB 이/JKS 백/NR 을/JKO 헤아리/VV 고/EC ,/SP 남경/NNP 에서/JKB 	배/NNG	를/JKO 타/VV 고/EC 건너오/VV ᆫ/ETM 것/NNB 이/JKS 천/NR 을/JKO 헤아리/VV ᆫ다/EF ./SF 
배__09/NNG	고금/NNG 의/JKG 이서/NNG ,/SP 백중/NNP 의/JKG 문집/NNG 등/NNB 도/JX 간행/NNG 되/XSV 고/EC 있/VX 으며/EC 그/MM 수/NNG 는/JX 한국/NNP 의/JKG 10/SN 	배/NNG	를/JKO 넘/VV 는다/EF ./SF 
배__02/NNG	겨우/MAG 높/VA 은/ETM 나막신/NNG (/SS 게다/NNG )/SS 을/JKO 신/VV 고/EC 시/NNG 한/XPN 복판/NNG 을/JKO 줄짓/VV 어/EC 걸어가/VV 면서/EC 고통/NNG 을/JKO 무릅쓰/VV 고/EC 용감/XR 하/XSA 게/EC 	배/NNG	를/JKO 가르/VV 았/EP 다/EF ./SF 
배__01/NNG	외침/NNG 으로/JKB 약체/NNG 를/JKO 드러내/VV 고/EC 고프/VA ᆫ/ETM 	배/NNG	를/JKO 안/VV 은/ETM 지배/NNG 층/XSN 은/JX 군공/NNG 과/JC 납속/NNG 에/JKB 의하/VV ᆫ/ETM 특례/NNG 를/JKO 설치/NNG 하/XSV 게/EC 되/VV 어/EC 그/MM 권위/NNG 가/JKS 흔들리/VV 기/ETN 시작/NNG 
배__01/NNG	그러나/MAJ 무사/NNG 들/XSN 이/JKS 하/VV 는/ETM 일/NNG 을/JKO 거들떠보/VV 지/EC 도/JX 않/VX 은/ETM 농민/NNG 때문/NNB 에/JKB 실패/NNG 하/XSV 았/EP 고/EC ,/SP 그/NP 는/JX 스스로/MAG 	배/NNG	를/JKO 가르/VV 아/EC 죽/VV 는/ETM 수/NNB 밖에/JX 없/VA 었/EP 다/EF ./SF 
배__01/NNG		배/NNG	를/JKO 가르/VV ᆯ/ETM 때/NNG 의/JKG 고통/NNG 을/JKO 참/VV 고/EC 견디/VV 는/ETM 것/NNB 을/JKO 예의/NNG 로/JKB 알/VV 는/ETM 사회/NNG 에서/JKB 는/JX 사별/NNG 의/JKG 슬픔/NNG 을/JKO 나타내/VV 
배__02/NNG	기꺼이/MAG 	배/NNG	를/JKO 가르/VV 는/ETM 것/NNB 은/JX 그만큼/MAG 그/MM 목적/NNG 을/JKO 위하/VV 아/EC 일/NNG 을/JKO 하/VV 았/EP 다고/EC 하/VV 는/ETM 정신/NNG 성/XSN 의/JKG 과시/NNG 와/JKB 통하/VV 기/ETN 
배__02/NNG	가/VX ᆫ/ETM 정숙/NNG 하/XSA ᆫ/ETM 사대부/NNG 의/JKG 아내/NNG 는/JX 나루터/NNG 에서/JKB 내밀/VV ᆫ/ETM 뱃사공/NNG 의/JKG 손/NNG 을/JKO 자기/NP 도/JX 모르/VV 는/ETM 사이/NNG 에/JKB 붙잡/VV 고/EC 	배/NNG	에/JKB 올라타/VV 았/EP 다/EF ./SF 
배__01/NNG	필요/NNG 하/XSA 다면/EC 	배/NNG	이/VCP 라도/EC 가르/VV 면서/EC 제/XPN 일/NR 선/NNG 에서/JKB 귀족/NNG 들/XSN 이/JKS 싸우/VV ᆯ/ETM 것/NNB ./SF 
